contribution_type,proposal_id,proposal_reference,proposal_title,proposal_votes_totalCount,proposal_createdAt,proposal_publishedAt,proposal_updatedAt,proposal_publicationStatus,proposal_trashedAt,proposal_trashedReason,proposal_link,proposal_author_id,proposal_author_username,proposal_author_isEmailConfirmed,proposal_author_email,proposal_author_userType_id,proposal_author_userType_name,proposal_status_name,proposal_estimation,proposal_category_name,proposal_theme_title,"Hap ou Noel ?","Votre fleuve préféré","Comme tu as choisi Hap et le Gange, je t'affiche cette question (dsl jui pas inspiré)","Par qui Hap a t-il été créé ?","Hap est-il un homme bon ?","Comment ça ce n'est pas un homme bon, comment oses-tu ?","Noel a t-il un rapport avec la fête de Noël ?","De quelle couleur est le chapeau de Noël ?","Plutôt Marvel ou DC ?","T'aimes bien Superman ?","T'aimes bien Batman ?","T'aimes bien Supergirl ?","T'aimes bien Iron Man ?","T'aimes bien Luke Cage ?","T'aimes bien Thor ?","C'est la fin mais j'affiche quand même des choix",proposal_formattedAddress,proposal_district_name,proposal_illustration,proposal_summary,proposal_description,proposal_votes_id,proposal_votes_createdAt,proposal_votes_publishedAt,proposal_votes_anonymous,proposal_votes_author_id,proposal_votes_author_username,proposal_votes_author_isEmailConfirmed,proposal_votes_ranking,proposal_votes_author_userType_id,proposal_votes_author_userType_name,proposal_comments_id,proposal_comments_body,proposal_comments_parent,proposal_comments_createdAt,proposal_comments_publishedAt,proposal_comments_updatedAt,proposal_comments_author_id,proposal_comments_author_username,proposal_comments_author_isEmailConfirmed,proposal_comments_author_userType_id,proposal_comments_author_userType_name,proposal_comments_author_email,proposal_comments_pinned,proposal_comments_publicationStatus,proposal_comments_vote_id,proposal_comments_vote_createdAt,proposal_comments_vote_publishedAt,proposal_comments_vote_published,proposal_comments_vote_author_id,proposal_comments_vote_author_username,proposal_comments_vote_author_isEmailConfirmed,proposal_comments_vote_author_userType_id,proposal_comments_vote_author_userType_name,proposal_news_id,proposal_news_title,proposal_news_themes,proposal_news_linkedProjects,proposal_news_linkedProposal,proposal_news_createdAt,proposal_news_updatedAt,proposal_news_publishedAt,proposal_news_publicationStatus,proposal_news_commentable,proposal_news_displayedOnBlog,proposal_news_authors_id,proposal_news_authors_username,proposal_news_authors_isEmailConfirmed,proposal_news_authors_userType_id,proposal_news_authors_userType_name,proposal_news_comments_id,proposal_news_comments_body,proposal_news_comments_parent,proposal_news_comments_createdAt,proposal_news_comments_updatedAt,proposal_news_comments_author_id,proposal_news_comments_author_username,proposal_news_comments_author_isEmailConfirmed,proposal_news_comments_author_userType_id,proposal_news_comments_author_userType_name,proposal_news_comments_author_email,proposal_news_comments_pinned,proposal_news_comments_publicationStatus,proposal_news_comments_vote_id,proposal_news_comments_vote_createdAt,proposal_news_comments_vote_publishedAt,proposal_news_comments_vote_published,proposal_news_comments_vote_author_id,proposal_news_comments_vote_author_username,proposal_news_comments_vote_author_isEmailConfirmed,proposal_news_comments_vote_author_userType_id,proposal_news_comments_vote_author_userType_name,proposal_news_comments_reportings_id,proposal_news_comments_reportings_createdAt,proposal_news_comments_reportings_published,proposal_news_comments_reportings_author_id,proposal_news_comments_reportings_author_username,proposal_news_comments_reportings_author_isEmailConfirmed,proposal_news_comments_reportings_author_userType_id,proposal_news_comments_reportings_author_userType_name,proposal_reportings_id,proposal_reportings_body,proposal_reportings_createdAt,proposal_reportings_author_id,proposal_reportings_author_username,proposal_reportings_author_isEmailConfirmed,proposal_reportings_author_userType_id,proposal_reportings_author_userType_name
proposal,UHJvcG9zYWw6cHJvcG9zYWwxMDA=,"""114-1100""","Proposal 100",0,@datetime@,@datetime@,@datetime@,PUBLISHED,,,https://capco.dev/projects/budget-participatif-rennes/collect/collecte-des-propositions-avec-questions/proposals/proposal-100,VXNlcjp1c2VyMQ==,lbrunet,1,lbrunet@jolicode.com,1,Citoyen,,,,,,,,,,,,,,,,,,,,,,,,,"Magni temporibus fuga ut non et. Rem maiores molestiae quo dolorem. Et quidem beatae sit ut qui. Ea modi ut qui blanditiis laudantium. Illum amet saepe enim beatae dolorum sed.",,,,,,,,,,,,,,,,,,,,,,,,,,,,,,,,,,,,,,,,,,,,,,,,,,,,,,,,,,,,,,,,,,,,,,,,,,,,,,,,,,,,,,,
proposal,UHJvcG9zYWw6cHJvcG9zYWwxMDE=,"""114-101""","Proposition sans titre",0,@datetime@,@datetime@,,PUBLISHED,,,https://capco.dev/projects/budget-participatif-rennes/collect/collecte-des-propositions-avec-questions/proposals/proposition-sans-titre,VXNlcjp1c2VyMQ==,lbrunet,1,lbrunet@jolicode.com,1,Citoyen,,,,,,,,,,,,,,,,,,,,,,,,,"Je suis une proposition crée en tant que fusion avec mon titre (FR) par défaut",,,,,,,,,,,,,,,,,,,,,,,,,,,,,,,,,,,,,,,,,,,,,,,,,,,,,,,,,,,,,,,,,,,,,,,,,,,,,,,,,,,,,,,
proposal,UHJvcG9zYWw6cHJvcG9zYWw0MA==,"""114-140""","Proposal 40",0,@datetime@,@datetime@,@datetime@,PUBLISHED,,,https://capco.dev/projects/budget-participatif-rennes/collect/collecte-des-propositions-avec-questions/proposals/proposal-40,VXNlcjp1c2VyMQ==,lbrunet,1,lbrunet@jolicode.com,1,Citoyen,,,,,,,,,,,,,,,,,,,,,,,,,"Nemo quisquam ex atque rerum porro debitis qui et. Voluptatem sapiente et illo accusantium nesciunt. Est consequatur harum quaerat qui quia ut maiores.",,,,,,,,,,,,,,,,,,,,,,,,,,,,,,,,,,,,,,,,,,,,,,,,,,,,,,,,,,,,,,,,,,,,,,,,,,,,,,,,,,,,,,,
proposal,UHJvcG9zYWw6cHJvcG9zYWw0MQ==,"""114-141""","Proposal 41",0,@datetime@,@datetime@,@datetime@,PUBLISHED,,,https://capco.dev/projects/budget-participatif-rennes/collect/collecte-des-propositions-avec-questions/proposals/proposal-41,VXNlcjp1c2VyMQ==,lbrunet,1,lbrunet@jolicode.com,1,Citoyen,,,,,,,,,,,,,,,,,,,,,,,,,"Sint explicabo enim laudantium officiis. Quia voluptatem tempora quos mollitia. Sapiente aperiam est dolor in odio et ullam. Inventore veritatis voluptates sequi rerum.",,,,,,,,,,,,,,,,,,,,,,,,,,,,,,,,,,,,,,,,,,,,,,,,,,,,,,,,,,,,,,,,,,,,,,,,,,,,,,,,,,,,,,,
proposal,UHJvcG9zYWw6cHJvcG9zYWw0Mg==,"""114-142""","Proposal 42",0,@datetime@,@datetime@,@datetime@,PUBLISHED,,,https://capco.dev/projects/budget-participatif-rennes/collect/collecte-des-propositions-avec-questions/proposals/proposal-42,VXNlcjp1c2VyMQ==,lbrunet,1,lbrunet@jolicode.com,1,Citoyen,,,,,,,,,,,,,,,,,,,,,,,,,"Ut odio totam beatae maxime ipsa et. Labore sint magnam enim quaerat sed omnis. Voluptatum nihil ullam nam dolorem.",,,,,,,,,,,,,,,,,,,,,,,,,,,,,,,,,,,,,,,,,,,,,,,,,,,,,,,,,,,,,,,,,,,,,,,,,,,,,,,,,,,,,,,
proposal,UHJvcG9zYWw6cHJvcG9zYWw0Mw==,"""114-143""","Proposal 43",0,@datetime@,@datetime@,@datetime@,PUBLISHED,,,https://capco.dev/projects/budget-participatif-rennes/collect/collecte-des-propositions-avec-questions/proposals/proposal-43,VXNlcjp1c2VyMQ==,lbrunet,1,lbrunet@jolicode.com,1,Citoyen,,,,,,,,,,,,,,,,,,,,,,,,,"Numquam perspiciatis optio aut beatae. Quod aspernatur sed rerum voluptas voluptatum eos. Laborum sunt inventore voluptas impedit.",,,,,,,,,,,,,,,,,,,,,,,,,,,,,,,,,,,,,,,,,,,,,,,,,,,,,,,,,,,,,,,,,,,,,,,,,,,,,,,,,,,,,,,
proposal,UHJvcG9zYWw6cHJvcG9zYWw0NA==,"""114-144""","Proposal 44",0,@datetime@,@datetime@,@datetime@,PUBLISHED,,,https://capco.dev/projects/budget-participatif-rennes/collect/collecte-des-propositions-avec-questions/proposals/proposal-44,VXNlcjp1c2VyMQ==,lbrunet,1,lbrunet@jolicode.com,1,Citoyen,,,,,,,,,,,,,,,,,,,,,,,,,"Dolorum perferendis quia qui dolorem saepe deserunt. Eos ipsa dolorum non est optio. Qui sunt quas beatae numquam eligendi aperiam.",,,,,,,,,,,,,,,,,,,,,,,,,,,,,,,,,,,,,,,,,,,,,,,,,,,,,,,,,,,,,,,,,,,,,,,,,,,,,,,,,,,,,,,
proposal,UHJvcG9zYWw6cHJvcG9zYWw0NQ==,"""114-145""","Proposal 45",0,@datetime@,@datetime@,@datetime@,PUBLISHED,,,https://capco.dev/projects/budget-participatif-rennes/collect/collecte-des-propositions-avec-questions/proposals/proposal-45,VXNlcjp1c2VyMQ==,lbrunet,1,lbrunet@jolicode.com,1,Citoyen,,,,,,,,,,,,,,,,,,,,,,,,,"Non eum sint architecto quia accusantium laborum rem facere. Numquam iusto quos rerum. Labore ratione quo repellendus accusamus.",,,,,,,,,,,,,,,,,,,,,,,,,,,,,,,,,,,,,,,,,,,,,,,,,,,,,,,,,,,,,,,,,,,,,,,,,,,,,,,,,,,,,,,
proposal,UHJvcG9zYWw6cHJvcG9zYWw0Ng==,"""114-146""","Proposal 46",0,@datetime@,@datetime@,@datetime@,PUBLISHED,,,https://capco.dev/projects/budget-participatif-rennes/collect/collecte-des-propositions-avec-questions/proposals/proposal-46,VXNlcjp1c2VyMQ==,lbrunet,1,lbrunet@jolicode.com,1,Citoyen,,,,,,,,,,,,,,,,,,,,,,,,,"Et iusto vel ut sapiente. Eius dignissimos accusantium architecto est. Rerum voluptatem earum illum est placeat voluptatem. Itaque itaque ut nesciunt voluptatibus et nostrum.",,,,,,,,,,,,,,,,,,,,,,,,,,,,,,,,,,,,,,,,,,,,,,,,,,,,,,,,,,,,,,,,,,,,,,,,,,,,,,,,,,,,,,,
proposal,UHJvcG9zYWw6cHJvcG9zYWw0Nw==,"""114-147""","Proposal 47",0,@datetime@,@datetime@,@datetime@,PUBLISHED,,,https://capco.dev/projects/budget-participatif-rennes/collect/collecte-des-propositions-avec-questions/proposals/proposal-47,VXNlcjp1c2VyMQ==,lbrunet,1,lbrunet@jolicode.com,1,Citoyen,,,,,,,,,,,,,,,,,,,,,,,,,"Qui repellendus dolores fugiat ut ipsam illo. Numquam accusantium ut provident et. Voluptate porro est tenetur illo sint ducimus.",,,,,,,,,,,,,,,,,,,,,,,,,,,,,,,,,,,,,,,,,,,,,,,,,,,,,,,,,,,,,,,,,,,,,,,,,,,,,,,,,,,,,,,
proposal,UHJvcG9zYWw6cHJvcG9zYWw0OA==,"""114-148""","Proposal 48",0,@datetime@,@datetime@,@datetime@,PUBLISHED,,,https://capco.dev/projects/budget-participatif-rennes/collect/collecte-des-propositions-avec-questions/proposals/proposal-48,VXNlcjp1c2VyMQ==,lbrunet,1,lbrunet@jolicode.com,1,Citoyen,,,,,,,,,,,,,,,,,,,,,,,,,"Et et vel laborum quisquam numquam vero aperiam. Quis suscipit non unde. Excepturi fugit reprehenderit exercitationem dolorum laboriosam facilis maiores. Sed cupiditate assumenda qui commodi dolor.",,,,,,,,,,,,,,,,,,,,,,,,,,,,,,,,,,,,,,,,,,,,,,,,,,,,,,,,,,,,,,,,,,,,,,,,,,,,,,,,,,,,,,,
proposal,UHJvcG9zYWw6cHJvcG9zYWw0OQ==,"""114-149""","Proposal 49",0,@datetime@,@datetime@,@datetime@,PUBLISHED,,,https://capco.dev/projects/budget-participatif-rennes/collect/collecte-des-propositions-avec-questions/proposals/proposal-49,VXNlcjp1c2VyMQ==,lbrunet,1,lbrunet@jolicode.com,1,Citoyen,,,,,,,,,,,,,,,,,,,,,,,,,"Et iste est fugiat ratione. Vitae accusamus incidunt quasi saepe. Incidunt nam molestiae atque est porro et. Enim culpa quibusdam sed blanditiis ex.",,,,,,,,,,,,,,,,,,,,,,,,,,,,,,,,,,,,,,,,,,,,,,,,,,,,,,,,,,,,,,,,,,,,,,,,,,,,,,,,,,,,,,,
proposal,UHJvcG9zYWw6cHJvcG9zYWw1MA==,"""114-150""","Proposal 50",0,@datetime@,@datetime@,@datetime@,PUBLISHED,,,https://capco.dev/projects/budget-participatif-rennes/collect/collecte-des-propositions-avec-questions/proposals/proposal-50,VXNlcjp1c2VyMQ==,lbrunet,1,lbrunet@jolicode.com,1,Citoyen,,,,,,,,,,,,,,,,,,,,,,,,,"Mollitia cumque ducimus velit et. Dolorem quis molestiae quia expedita maiores.",,,,,,,,,,,,,,,,,,,,,,,,,,,,,,,,,,,,,,,,,,,,,,,,,,,,,,,,,,,,,,,,,,,,,,,,,,,,,,,,,,,,,,,
proposal,UHJvcG9zYWw6cHJvcG9zYWw1MQ==,"""114-151""","Proposal 51",0,@datetime@,@datetime@,@datetime@,PUBLISHED,,,https://capco.dev/projects/budget-participatif-rennes/collect/collecte-des-propositions-avec-questions/proposals/proposal-51,VXNlcjp1c2VyMQ==,lbrunet,1,lbrunet@jolicode.com,1,Citoyen,,,,,,,,,,,,,,,,,,,,,,,,,"Culpa repudiandae fugiat libero libero aut. Doloremque corporis minima impedit omnis deserunt quasi sunt consequatur. Nemo placeat repudiandae beatae et ea. Quaerat alias aut non et quia dolorum.",,,,,,,,,,,,,,,,,,,,,,,,,,,,,,,,,,,,,,,,,,,,,,,,,,,,,,,,,,,,,,,,,,,,,,,,,,,,,,,,,,,,,,,
proposal,UHJvcG9zYWw6cHJvcG9zYWw1Mg==,"""114-152""","Proposal 52",0,@datetime@,@datetime@,@datetime@,PUBLISHED,,,https://capco.dev/projects/budget-participatif-rennes/collect/collecte-des-propositions-avec-questions/proposals/proposal-52,VXNlcjp1c2VyMQ==,lbrunet,1,lbrunet@jolicode.com,1,Citoyen,,,,,,,,,,,,,,,,,,,,,,,,,"Distinctio tempora et repudiandae hic voluptas quam consequatur. Sit et eveniet commodi. Qui deserunt repellendus tempora illo dolorem dolor tempore laudantium.",,,,,,,,,,,,,,,,,,,,,,,,,,,,,,,,,,,,,,,,,,,,,,,,,,,,,,,,,,,,,,,,,,,,,,,,,,,,,,,,,,,,,,,
proposal,UHJvcG9zYWw6cHJvcG9zYWw1Mw==,"""114-153""","Proposal 53",0,@datetime@,@datetime@,@datetime@,PUBLISHED,,,https://capco.dev/projects/budget-participatif-rennes/collect/collecte-des-propositions-avec-questions/proposals/proposal-53,VXNlcjp1c2VyMQ==,lbrunet,1,lbrunet@jolicode.com,1,Citoyen,,,,,,,,,,,,,,,,,,,,,,,,,"Rem dolores alias harum et pariatur. Adipisci alias repellat ab quia qui blanditiis.",,,,,,,,,,,,,,,,,,,,,,,,,,,,,,,,,,,,,,,,,,,,,,,,,,,,,,,,,,,,,,,,,,,,,,,,,,,,,,,,,,,,,,,
proposal,UHJvcG9zYWw6cHJvcG9zYWw1NA==,"""114-154""","Proposal 54",0,@datetime@,@datetime@,@datetime@,PUBLISHED,,,https://capco.dev/projects/budget-participatif-rennes/collect/collecte-des-propositions-avec-questions/proposals/proposal-54,VXNlcjp1c2VyMQ==,lbrunet,1,lbrunet@jolicode.com,1,Citoyen,,,,,,,,,,,,,,,,,,,,,,,,,"Aut est omnis cupiditate ea saepe quos. Ex expedita qui quo rerum exercitationem libero molestiae et. Rerum deleniti amet minus provident nihil sunt voluptatem.",,,,,,,,,,,,,,,,,,,,,,,,,,,,,,,,,,,,,,,,,,,,,,,,,,,,,,,,,,,,,,,,,,,,,,,,,,,,,,,,,,,,,,,
proposal,UHJvcG9zYWw6cHJvcG9zYWw1NQ==,"""114-155""","Proposal 55",0,@datetime@,@datetime@,@datetime@,PUBLISHED,,,https://capco.dev/projects/budget-participatif-rennes/collect/collecte-des-propositions-avec-questions/proposals/proposal-55,VXNlcjp1c2VyMQ==,lbrunet,1,lbrunet@jolicode.com,1,Citoyen,,,,,,,,,,,,,,,,,,,,,,,,,"Accusantium culpa ut deserunt et aliquam et. Ab quod aliquam sit quo rerum. Eveniet et omnis quibusdam quod qui. Ut laboriosam fugiat illum maiores optio officia quos.",,,,,,,,,,,,,,,,,,,,,,,,,,,,,,,,,,,,,,,,,,,,,,,,,,,,,,,,,,,,,,,,,,,,,,,,,,,,,,,,,,,,,,,
proposal,UHJvcG9zYWw6cHJvcG9zYWw1Ng==,"""114-156""","Proposal 56",0,@datetime@,@datetime@,@datetime@,PUBLISHED,,,https://capco.dev/projects/budget-participatif-rennes/collect/collecte-des-propositions-avec-questions/proposals/proposal-56,VXNlcjp1c2VyMQ==,lbrunet,1,lbrunet@jolicode.com,1,Citoyen,,,,,,,,,,,,,,,,,,,,,,,,,"Quia quo aut molestiae nihil minima aut temporibus. Libero tenetur et illum possimus quidem quia. Itaque harum modi omnis amet quasi odit. Ut sint beatae cum autem id totam repellendus quia.",,,,,,,,,,,,,,,,,,,,,,,,,,,,,,,,,,,,,,,,,,,,,,,,,,,,,,,,,,,,,,,,,,,,,,,,,,,,,,,,,,,,,,,
proposal,UHJvcG9zYWw6cHJvcG9zYWw1Nw==,"""114-157""","Proposal 57",0,@datetime@,@datetime@,@datetime@,PUBLISHED,,,https://capco.dev/projects/budget-participatif-rennes/collect/collecte-des-propositions-avec-questions/proposals/proposal-57,VXNlcjp1c2VyMQ==,lbrunet,1,lbrunet@jolicode.com,1,Citoyen,,,,,,,,,,,,,,,,,,,,,,,,,"Nesciunt aut ipsa perferendis aut accusamus maiores. Non quis rerum ipsa quidem. Delectus animi repellendus temporibus numquam.",,,,,,,,,,,,,,,,,,,,,,,,,,,,,,,,,,,,,,,,,,,,,,,,,,,,,,,,,,,,,,,,,,,,,,,,,,,,,,,,,,,,,,,
proposal,UHJvcG9zYWw6cHJvcG9zYWw1OA==,"""114-158""","Proposal 58",0,@datetime@,@datetime@,@datetime@,PUBLISHED,,,https://capco.dev/projects/budget-participatif-rennes/collect/collecte-des-propositions-avec-questions/proposals/proposal-58,VXNlcjp1c2VyMQ==,lbrunet,1,lbrunet@jolicode.com,1,Citoyen,,,,,,,,,,,,,,,,,,,,,,,,,"Ut sapiente quis soluta saepe impedit. Quas alias sunt sunt officia est.",,,,,,,,,,,,,,,,,,,,,,,,,,,,,,,,,,,,,,,,,,,,,,,,,,,,,,,,,,,,,,,,,,,,,,,,,,,,,,,,,,,,,,,
proposal,UHJvcG9zYWw6cHJvcG9zYWw1OQ==,"""114-159""","Proposal 59",0,@datetime@,@datetime@,@datetime@,PUBLISHED,,,https://capco.dev/projects/budget-participatif-rennes/collect/collecte-des-propositions-avec-questions/proposals/proposal-59,VXNlcjp1c2VyMQ==,lbrunet,1,lbrunet@jolicode.com,1,Citoyen,,,,,,,,,,,,,,,,,,,,,,,,,"Ut quas ipsum modi repellendus. Qui doloremque quidem dolore animi at nobis pariatur ut. Tempore quod voluptas aliquam delectus esse cumque.",,,,,,,,,,,,,,,,,,,,,,,,,,,,,,,,,,,,,,,,,,,,,,,,,,,,,,,,,,,,,,,,,,,,,,,,,,,,,,,,,,,,,,,
proposal,UHJvcG9zYWw6cHJvcG9zYWw2MA==,"""114-160""","Proposal 60",0,@datetime@,@datetime@,@datetime@,PUBLISHED,,,https://capco.dev/projects/budget-participatif-rennes/collect/collecte-des-propositions-avec-questions/proposals/proposal-60,VXNlcjp1c2VyMQ==,lbrunet,1,lbrunet@jolicode.com,1,Citoyen,,,,,,,,,,,,,,,,,,,,,,,,,"Qui mollitia consectetur voluptatibus aut. Inventore est a odit veniam iusto dolorem. Voluptas voluptatem ea nostrum facere.",,,,,,,,,,,,,,,,,,,,,,,,,,,,,,,,,,,,,,,,,,,,,,,,,,,,,,,,,,,,,,,,,,,,,,,,,,,,,,,,,,,,,,,
proposal,UHJvcG9zYWw6cHJvcG9zYWw2MQ==,"""114-161""","Proposal 61",0,@datetime@,@datetime@,@datetime@,PUBLISHED,,,https://capco.dev/projects/budget-participatif-rennes/collect/collecte-des-propositions-avec-questions/proposals/proposal-61,VXNlcjp1c2VyMQ==,lbrunet,1,lbrunet@jolicode.com,1,Citoyen,,,,,,,,,,,,,,,,,,,,,,,,,"Rem nam aspernatur eveniet quidem omnis sit. Repellendus ex at accusamus. Qui accusamus consequatur ut labore aliquam ullam unde aspernatur.",,,,,,,,,,,,,,,,,,,,,,,,,,,,,,,,,,,,,,,,,,,,,,,,,,,,,,,,,,,,,,,,,,,,,,,,,,,,,,,,,,,,,,,
proposal,UHJvcG9zYWw6cHJvcG9zYWw2Mg==,"""114-162""","Proposal 62",0,@datetime@,@datetime@,@datetime@,PUBLISHED,,,https://capco.dev/projects/budget-participatif-rennes/collect/collecte-des-propositions-avec-questions/proposals/proposal-62,VXNlcjp1c2VyMQ==,lbrunet,1,lbrunet@jolicode.com,1,Citoyen,,,,,,,,,,,,,,,,,,,,,,,,,"Totam voluptatem soluta totam. Omnis asperiores aliquam numquam. Qui officiis recusandae eum magni earum omnis. Quis et quia ut rerum est enim.",,,,,,,,,,,,,,,,,,,,,,,,,,,,,,,,,,,,,,,,,,,,,,,,,,,,,,,,,,,,,,,,,,,,,,,,,,,,,,,,,,,,,,,
proposal,UHJvcG9zYWw6cHJvcG9zYWw2Mw==,"""114-163""","Proposal 63",0,@datetime@,@datetime@,@datetime@,PUBLISHED,,,https://capco.dev/projects/budget-participatif-rennes/collect/collecte-des-propositions-avec-questions/proposals/proposal-63,VXNlcjp1c2VyMQ==,lbrunet,1,lbrunet@jolicode.com,1,Citoyen,,,,,,,,,,,,,,,,,,,,,,,,,"Blanditiis quisquam quae molestias non impedit voluptates. Debitis eos quo impedit velit. Quia nihil ratione dolore dolore omnis. Est quaerat aperiam ut nihil rerum. Non voluptatem possimus rerum.",,,,,,,,,,,,,,,,,,,,,,,,,,,,,,,,,,,,,,,,,,,,,,,,,,,,,,,,,,,,,,,,,,,,,,,,,,,,,,,,,,,,,,,
proposal,UHJvcG9zYWw6cHJvcG9zYWw2NA==,"""114-164""","Proposal 64",0,@datetime@,@datetime@,@datetime@,PUBLISHED,,,https://capco.dev/projects/budget-participatif-rennes/collect/collecte-des-propositions-avec-questions/proposals/proposal-64,VXNlcjp1c2VyMQ==,lbrunet,1,lbrunet@jolicode.com,1,Citoyen,,,,,,,,,,,,,,,,,,,,,,,,,"Quia ut est aut reprehenderit facilis ab rem sapiente. Tempore ex sint aliquid.",,,,,,,,,,,,,,,,,,,,,,,,,,,,,,,,,,,,,,,,,,,,,,,,,,,,,,,,,,,,,,,,,,,,,,,,,,,,,,,,,,,,,,,
proposal,UHJvcG9zYWw6cHJvcG9zYWw2NQ==,"""114-165""","Proposal 65",0,@datetime@,@datetime@,@datetime@,PUBLISHED,,,https://capco.dev/projects/budget-participatif-rennes/collect/collecte-des-propositions-avec-questions/proposals/proposal-65,VXNlcjp1c2VyMQ==,lbrunet,1,lbrunet@jolicode.com,1,Citoyen,,,,,,,,,,,,,,,,,,,,,,,,,"Aliquam autem fugit consequatur nihil qui. Error voluptatum totam veniam possimus veritatis. Quis cum est quis.",,,,,,,,,,,,,,,,,,,,,,,,,,,,,,,,,,,,,,,,,,,,,,,,,,,,,,,,,,,,,,,,,,,,,,,,,,,,,,,,,,,,,,,
proposal,UHJvcG9zYWw6cHJvcG9zYWw2Ng==,"""114-166""","Proposal 66",0,@datetime@,@datetime@,@datetime@,PUBLISHED,,,https://capco.dev/projects/budget-participatif-rennes/collect/collecte-des-propositions-avec-questions/proposals/proposal-66,VXNlcjp1c2VyMQ==,lbrunet,1,lbrunet@jolicode.com,1,Citoyen,,,,,,,,,,,,,,,,,,,,,,,,,"Sequi possimus a unde adipisci autem odit ad optio. Animi rerum quibusdam qui et praesentium. Culpa magnam vel aut ipsum.",,,,,,,,,,,,,,,,,,,,,,,,,,,,,,,,,,,,,,,,,,,,,,,,,,,,,,,,,,,,,,,,,,,,,,,,,,,,,,,,,,,,,,,
proposal,UHJvcG9zYWw6cHJvcG9zYWw2Nw==,"""114-167""","Proposal 67",0,@datetime@,@datetime@,@datetime@,PUBLISHED,,,https://capco.dev/projects/budget-participatif-rennes/collect/collecte-des-propositions-avec-questions/proposals/proposal-67,VXNlcjp1c2VyMQ==,lbrunet,1,lbrunet@jolicode.com,1,Citoyen,,,,,,,,,,,,,,,,,,,,,,,,,"Dolor quod qui ut ut omnis aut quis repellat. Sunt dolor sed perspiciatis voluptatem qui. Incidunt aut et reprehenderit nostrum deserunt voluptatem molestias. Cupiditate quo explicabo sit id.",,,,,,,,,,,,,,,,,,,,,,,,,,,,,,,,,,,,,,,,,,,,,,,,,,,,,,,,,,,,,,,,,,,,,,,,,,,,,,,,,,,,,,,
proposal,UHJvcG9zYWw6cHJvcG9zYWw2OA==,"""114-168""","Proposal 68",0,@datetime@,@datetime@,@datetime@,PUBLISHED,,,https://capco.dev/projects/budget-participatif-rennes/collect/collecte-des-propositions-avec-questions/proposals/proposal-68,VXNlcjp1c2VyMQ==,lbrunet,1,lbrunet@jolicode.com,1,Citoyen,,,,,,,,,,,,,,,,,,,,,,,,,"Ipsum labore labore voluptas et error. Sequi nihil molestias molestiae veritatis velit deleniti eum et. Sint ut ipsam rem veniam velit rerum hic autem.",,,,,,,,,,,,,,,,,,,,,,,,,,,,,,,,,,,,,,,,,,,,,,,,,,,,,,,,,,,,,,,,,,,,,,,,,,,,,,,,,,,,,,,
proposal,UHJvcG9zYWw6cHJvcG9zYWw2OQ==,"""114-169""","Proposal 69",0,@datetime@,@datetime@,@datetime@,PUBLISHED,,,https://capco.dev/projects/budget-participatif-rennes/collect/collecte-des-propositions-avec-questions/proposals/proposal-69,VXNlcjp1c2VyMQ==,lbrunet,1,lbrunet@jolicode.com,1,Citoyen,,,,,,,,,,,,,,,,,,,,,,,,,"Quos ex accusantium est porro vel. Placeat quo dolores occaecati rerum.",,,,,,,,,,,,,,,,,,,,,,,,,,,,,,,,,,,,,,,,,,,,,,,,,,,,,,,,,,,,,,,,,,,,,,,,,,,,,,,,,,,,,,,
proposal,UHJvcG9zYWw6cHJvcG9zYWw3MA==,"""114-170""","Proposal 70",0,@datetime@,@datetime@,@datetime@,PUBLISHED,,,https://capco.dev/projects/budget-participatif-rennes/collect/collecte-des-propositions-avec-questions/proposals/proposal-70,VXNlcjp1c2VyMQ==,lbrunet,1,lbrunet@jolicode.com,1,Citoyen,,,,,,,,,,,,,,,,,,,,,,,,,"Eos aliquid placeat quisquam magnam reiciendis odit quis. Omnis aliquid eaque nisi aut voluptas aliquid voluptate. Eligendi eum laboriosam quae natus eos.",,,,,,,,,,,,,,,,,,,,,,,,,,,,,,,,,,,,,,,,,,,,,,,,,,,,,,,,,,,,,,,,,,,,,,,,,,,,,,,,,,,,,,,
proposal,UHJvcG9zYWw6cHJvcG9zYWw3MQ==,"""114-171""","Proposal 71",0,@datetime@,@datetime@,@datetime@,PUBLISHED,,,https://capco.dev/projects/budget-participatif-rennes/collect/collecte-des-propositions-avec-questions/proposals/proposal-71,VXNlcjp1c2VyMQ==,lbrunet,1,lbrunet@jolicode.com,1,Citoyen,,,,,,,,,,,,,,,,,,,,,,,,,"Hic enim omnis iste magnam nisi sit. Voluptas qui harum qui quo enim consectetur et. Asperiores et aspernatur natus cumque consequuntur aut eum numquam. Sint facilis et error asperiores iusto.",,,,,,,,,,,,,,,,,,,,,,,,,,,,,,,,,,,,,,,,,,,,,,,,,,,,,,,,,,,,,,,,,,,,,,,,,,,,,,,,,,,,,,,
proposal,UHJvcG9zYWw6cHJvcG9zYWw3Mg==,"""114-172""","Proposal 72",0,@datetime@,@datetime@,@datetime@,PUBLISHED,,,https://capco.dev/projects/budget-participatif-rennes/collect/collecte-des-propositions-avec-questions/proposals/proposal-72,VXNlcjp1c2VyMQ==,lbrunet,1,lbrunet@jolicode.com,1,Citoyen,,,,,,,,,,,,,,,,,,,,,,,,,"Fugit illo autem qui ullam aut. Sequi cum et ex dolores quisquam quae a. Excepturi eos voluptatum voluptatum pariatur.",,,,,,,,,,,,,,,,,,,,,,,,,,,,,,,,,,,,,,,,,,,,,,,,,,,,,,,,,,,,,,,,,,,,,,,,,,,,,,,,,,,,,,,
proposal,UHJvcG9zYWw6cHJvcG9zYWw3Mw==,"""114-173""","Proposal 73",0,@datetime@,@datetime@,@datetime@,PUBLISHED,,,https://capco.dev/projects/budget-participatif-rennes/collect/collecte-des-propositions-avec-questions/proposals/proposal-73,VXNlcjp1c2VyMQ==,lbrunet,1,lbrunet@jolicode.com,1,Citoyen,,,,,,,,,,,,,,,,,,,,,,,,,"Quis odit quis voluptatum non id. Autem cupiditate non aspernatur corporis iste omnis. Dolor adipisci odio enim modi quo quis voluptatem. In delectus quasi et velit ipsam aut nihil.",,,,,,,,,,,,,,,,,,,,,,,,,,,,,,,,,,,,,,,,,,,,,,,,,,,,,,,,,,,,,,,,,,,,,,,,,,,,,,,,,,,,,,,
proposal,UHJvcG9zYWw6cHJvcG9zYWw3NA==,"""114-174""","Proposal 74",0,@datetime@,@datetime@,@datetime@,PUBLISHED,,,https://capco.dev/projects/budget-participatif-rennes/collect/collecte-des-propositions-avec-questions/proposals/proposal-74,VXNlcjp1c2VyMQ==,lbrunet,1,lbrunet@jolicode.com,1,Citoyen,,,,,,,,,,,,,,,,,,,,,,,,,"Nisi est qui cum occaecati adipisci expedita quam. Voluptatibus quidem molestiae minima itaque aliquid nihil saepe ea. Est et vel nam possimus. Porro id ratione aliquam voluptatem amet.",,,,,,,,,,,,,,,,,,,,,,,,,,,,,,,,,,,,,,,,,,,,,,,,,,,,,,,,,,,,,,,,,,,,,,,,,,,,,,,,,,,,,,,
proposal,UHJvcG9zYWw6cHJvcG9zYWw3NQ==,"""114-175""","Proposal 75",0,@datetime@,@datetime@,@datetime@,PUBLISHED,,,https://capco.dev/projects/budget-participatif-rennes/collect/collecte-des-propositions-avec-questions/proposals/proposal-75,VXNlcjp1c2VyMQ==,lbrunet,1,lbrunet@jolicode.com,1,Citoyen,,,,,,,,,,,,,,,,,,,,,,,,,"Rem consequatur sunt ipsum ut cupiditate commodi. Consequatur quia doloribus nam laborum laborum. Aspernatur sequi natus quia itaque.",,,,,,,,,,,,,,,,,,,,,,,,,,,,,,,,,,,,,,,,,,,,,,,,,,,,,,,,,,,,,,,,,,,,,,,,,,,,,,,,,,,,,,,
proposal,UHJvcG9zYWw6cHJvcG9zYWw3Ng==,"""114-176""","Proposal 76",0,@datetime@,@datetime@,@datetime@,PUBLISHED,,,https://capco.dev/projects/budget-participatif-rennes/collect/collecte-des-propositions-avec-questions/proposals/proposal-76,VXNlcjp1c2VyMQ==,lbrunet,1,lbrunet@jolicode.com,1,Citoyen,,,,,,,,,,,,,,,,,,,,,,,,,"Distinctio quasi nisi ea modi vel eos et cupiditate. Deserunt ea voluptatem voluptatem itaque quasi quidem accusantium. Voluptatem illo molestiae laborum aspernatur quae alias.",,,,,,,,,,,,,,,,,,,,,,,,,,,,,,,,,,,,,,,,,,,,,,,,,,,,,,,,,,,,,,,,,,,,,,,,,,,,,,,,,,,,,,,
