name,author,district_name,address,collect_status,estimation,category,summary,body,Adresse,Résumé,Objectif
Pour le sport rue Edouard Vaillant,Etienne Vincent ,"Bas Montreuil-République /
Étienne Marcel-Chanzy / Bobillot",,Nouvelle proposition,,Sports,," Au 44 rue Edouard Vaillant se trouve un terrain de football en terre et les restes d'un terrain de basket, clôturé en grillage. Ce sont surtout les enfants du quartier qui s'y retrouvent.Une option un peu plus chère, mais meilleure à mon avis, serait de réduire la taille du terrain de foot en changeant son orientation, car il est surtout utilisé par des enfants, pour permettre l'ajout d'un skate-park entre le terrain de foot et le terrain de basket...",Terrain de sport rue Edouard Vaillant,Réhabilitation du terrain de basket / foot,Réhabilitation du terrain de basket/foot rue Edouard Vaillant
Aménagement agréable et ludique de l'exterieur de Comme Vous Emoi – côté rue de la révolution,Fanny Morvan ,"Bas Montreuil-République /
Étienne Marcel-Chanzy / Bobillot",,Nouvelle proposition,,Aménagement et Mobilier Urbain,," Notre projet répond à des objectifs d'amélioration d'environnement et de création ludique.Installation d'un bac de récupération d'eau. Cette eau pourra notamment être filtrée afin de l'utiliser pour le jardinage
Conception et installation d'un parcours de l'eau",Rue de la Révolution,Notre projet répond à des objectifs d'amélioration d'environnement et de création ludique,Le projet répond à des objectifs d'amélioration d'environnement et de création ludique.
Le sport en sécurité,Faouzi Lalouni ,Solidarité-Carnot / Centre Ville / Jean Moulin – Beaumonts,,Nouvelle proposition,,Sports,,"Il s'agit de remettre à niveau le terrain de foot situé face à la maternelle Jean moulin, de changer la surface de jeux. Aujourd'hui elle est en béton, il s'agit d'en faire un terrain synthétique donc sécurisé, comme cela s'est fait à la rue parmentier.Il s'agit également de mettre des cages de foot à la dimension du terrain.",Terrain de foot situé face à la maternelle Jean Moulin,Manque de terrain de proximité sécurisé  - de plus en plus de jeunes ont envie de pratiquer du sport et n'ont pas les moyens de se payer une licence dans un club,manque de terrain de proximité sécurisé. -de plus en plus de jeunes ont envie de pratiquer du sport et n'ont pas les moyens de se payer une licence dans un club
Cœur de Ville,FAUCHER Eleonore,Solidarité-Carnot / Centre Ville / Jean Moulin – Beaumonts,,Nouvelle proposition,200000,Espaces verts,,Cœur de Ville,la rue Victor Hugo / square Zéfirottes,"Amélioration de l'espace public sur la rue Victor Hugo. Ajout de 2 table de ping-pong dans le square Zéfirottes devant l'école
",
Boulevard des arbres et de la diversité,Florence Frery ,"Bas Montreuil-République /
Étienne Marcel-Chanzy / Bobillot",,Nouvelle proposition,,Espaces verts,,"L'ensemble du bas Montreuil, manque d'espaces verts et de verdure même s'il y a eu la création de nouveaux petits squares, jardins partagés, espaces de jeux et l'agrandissement du terrain d'aventure.",Boulevard des arbres et de la diversité,"Planter des arbres / espaces végétalisés de manière continue et linéraire dans le Bas Montreuil jusqu'au jardin école, quartier du Bel Air. Créer un parcours découverte de la diversité","L'objectif est de planter dans les espaces vacants des trottoirs, angles de rue, pignons, végétalisation de murs et de créer une continuité et un linéaire;"
Donner à voir les murs à pêches,Florence Frery ,"Bel air-Grands pêchers /
Mur à pêches-Paul Signac",,Nouvelle proposition,,Espaces verts,,"L'idée de ce projet est née lors du dernier festival des murs à pêches : les parcelles aujourd'hui ouvertes sont situées sur les coteaux construire un belvédère en bois qui crée un accès, une passerelle entre le quartier du Bel Air et la prairie. Donner à voir les murs à pêches de notre ville et pourtant de l'intérieur, nous ne voyons pas l'ensemble.",Murs à Pêches,"Construire un belvédère en bois qui crée un accès, une passerelle entre le quartier du Bel Air et la prairie. Donner à voir les murs à pêches","Faire découvrir ce paysage si singulier avec une vision d'ensemble, en mesurer sa diversité, ses risques aussi et comment il s'intègre à Montreuil."
"
Les ados profitent de l'espace public
",Francis Proust ,Solidarité-Carnot / Centre Ville / Jean Moulin – Beaumonts,,Nouvelle proposition,,Culture et loisirs,,-Penser des structures légères à usages multiples pour créer des jeux/sports collectifs.,la Place Aimé Césaire,"Animation de la Place Aimé Césaire pour une installation légère destinée aux adolescents:

-Envisager / créer des lieux dédiés aux loisirs / sports pour les pré-adolescents - adolescents.

-Penser des structures légères à usages multiples pour créer des j",Animation de la Place Aimé Césaire pour une installation légère destinée aux adolescents
"
Le Nouveau Mandela",Frédéric Boyer ,Solidarité-Carnot / Centre Ville / Jean Moulin – Beaumonts,,Nouvelle proposition,40000,Espaces verts,,"Réhabilitaion du jardin d'enfants, des aires de jeux et des espaces verts de la résidence Mandela ; Faciliter et améliorer les accès à la résidence, sécuriser,  rendre accessible et aménager la passerelle située en façade de l'entrée Rue Colmet Lepinay, ",Résidence Mandela,"- Réhabilitation du jardin d'enfants, de l'aire de jeux
et des espaces verts de la résidence Mandela.

- Sécuriser, Rendre accessible et Aménager la
passerelle située en façade de l'entrée rue
Colmet Lepinay.

- Faciliter et Améliorer les accès à la résidence ",Redonner de la vie à des espaces qui à défaut d'être accessible servent de lieux de squat et sont détériorées. Cette propositon facilitera le mieux vivre ensemble
"Espace polyvalent, pédagogique et festif dans les Murs à Pêches",Frédéric Géral,"Bel air-Grands pêchers /
Mur à pêches-Paul Signac",,Nouvelle proposition,51000,Culture et loisirs,,"A la fois café social et populaire, espace culturel et festif à dimension horticole et agricole,  jardin public et zone d'ateliers créatifs et éducatifs ; ce lieu serait à la fois le lieu de rassemblement et de convergence des différents groupes auprès desquels le Sens de l'Humus et ses partenaires interviennent mais aussi et surtout un espace ouvert au grand public. ",Murs à Pêches,"Participer à l'aménagement du quartier et à la réhabilitation de la rue. Faire vivre le quartier, fair connaïtre les Murs à Pëches, sensibliser au Jardinage Naturel (dans tous ses aspects). Améliorer l'accueil public et développer des activités pédagogiqu",Participer à l'aménagement du quartier et à la réhabilitation de la rue ; - Faire vivre le quartier ; - Faire connaître les Murs à Pêches - Sensibiliser au Jardinage Naturel (dans tous ses aspects) - Améliorer l'accueil du public - Développer des activités pédagogiques et festives
Broyage de quartier et animations (jardinage écologique),Géral Frédéric ,"Bel air-Grands pêchers /
Mur à pêches-Paul Signac",,Nouvelle proposition,5000,Gestion des déchets,,"Dans le même esprit que celui du compostage collectif, nous proposons de mener des opérations de broyage de déchets verts en quartier (lieux et périodes de présence à définir), sur des sites de compostage collectif ou en déchetterie.",Ville,"Réduire le coût du rtaitement des déchets verts – réduire les déplacements en déchetterie. Comprendre l'intérêt du paillage grâce à des animations associées au broyage. Encourager des pratiques de paillage, de mulching et plus généralement de jardinage na","Réduire le coût du traitement des déchets verts,Réduire les déplacements en déchetterie "
Le square intergénérationnel Zoé Rue de Dhuys,HEDHUIN Céline /LEVASSOR Mrie-Brigitte,"Ramenas / Léo Lagrange /
Branly-Boissière",,Nouvelle proposition,,Culture et loisirs,,Le square intergénérationnel Zoé Rue de Dhuys,Le square intergénérationnel Zoé Rue de Dhuys,réhabilitation des espaces verts et publics dans le quartier Ramenas Léo Lagrange qui n'ont pas eu de rénovation depuis plus de 20 ans pour répondre à un besoin de vivre ensemble,
Le 7ème chemin,Helene Mathon,"Bel air-Grands pêchers /
Mur à pêches-Paul Signac",,Nouvelle proposition,,"Mobilité, circulation",,Nous proposons la piétonnisation de la rue des Hanots dans la portion comprise entre le carrefour des 7 Chemins et l'intersection avec la rue de la fontaine des Hanots.,Rue des Hanots (carrefour des 7 chemins et l'intersection avec la rue de la Fontaine des Hanots),"Sécurisation des piétons, en particulier des enfants, convivialité,tranquillité publique","Sécurisation des piétons, en particulier des enfants, convivialité, tranquilité publique"
"
Fresque murale allée Blériot
",HélèneDe Grandpré,"Ramenas / Léo Lagrange /
Branly-Boissière",,Nouvelle proposition,3000,Education et jeunesse,,"Certains de nos enfants, intéressés par le fait que même des jeunes à partir de 11 ans (accompagnés par des adultes) pouvaient se faire promoteur de projets ont avancé l'idée de réaliser une fresque murale.",,Réalisation d'une fresque mural par des enfants,ordre esthétique et social
Réaménagement des trottoirs et des bancs,Henriette Barbote,"Ramenas / Léo Lagrange /
Branly-Boissière",,Nouvelle proposition,200000,Aménagement et Mobilier Urbain,,Réaménagement des trottoirs et des bancs,NON RENSEIGNE,,Aménagement des trottoirs et bancs (amélioration urbaine)
Jeu stoppe ou encore,Isabel Choquet ,"Bel air-Grands pêchers /
Mur à pêches-Paul Signac",,Nouvelle proposition,,Culture et loisirs,,Jeu stoppe ou encore,Ville entière,"Instaurer dans divers endroits, du mobilier urbain ludique, des temps de pause : une table pour jouer aux échecs, des poubelles en haut d'un panier de basket. Pour arrêter le temps d'un jeu et d'un échange, sur une place, près d'un square, un côté d'une p",
Jardins verticaux,Isabel Choquet ,"Bel air-Grands pêchers /
Mur à pêches-Paul Signac",,Nouvelle proposition,,Espaces verts,,"Habiller les bâtiments de vert présente, outre des qualités esthétiques, de nombreux autres avantages. Les murs végétaux ont un effet apaisant sur notre humeur et favorisent notre bien-être général.",toute la ville,"Habiller les bâtiments de vert présentent, outre des qualités esthétiques, de nombreux auters avantages. Les murs végétaux ont un efet apaisant sur noter humeur et favorisent notre bien-être général",Embellissement
Signalétique artistique,Isabel Choquet ,"Bel air-Grands pêchers /
Mur à pêches-Paul Signac",,Nouvelle proposition,3450,Urbanisme,,"Dans le cadre du PRUS Bel - Grand pécher, l'installation d'une oeuvre artistique sur le château d'eau, la venue de nouvelles populations, d'une Maison de quartier High Tech, les différentes écoles, université... la mise en oeuvre d'un signalétique artistique semble opportun. Avec la collaboration d'association du secteur, peut-etre lors d'atelier avec la population... ",Prus Bel Air,Installation d'une œuvre artistique sur le château d'eau,Orientation dans un nouveau quartier
Nichoirs à martinets noirs et autres,Isabelle Pallard,"Bas Montreuil-République /
Étienne Marcel-Chanzy / Bobillot",,Nouvelle proposition,,Espaces verts,,Nichoirs à martinets noirs et autres, Ecoles primaires Jules Ferry / Guilands,"Reconstituer un habitat pérenne pour les oiseaux,
Avec les habitants de le rue des Guillands","Préservation de la biodiversité avec poursuite d'objectifs natura 200 aux Guiland, sensibilisation "
valorisation du marché de la Croix de Chavaux,Isabelle Susset ,"Bas Montreuil-République /
Étienne Marcel-Chanzy / Bobillot",,Nouvelle proposition,,Aménagement et Mobilier Urbain,,"Le marché de la croix de chavaux , très dynamique en terme d'activités et de commerces tout au long de l'année, possède une mauvaise hygiène générale et d'une sécurité faible pour les piètons pour s'y rendre. ",Secteur de la croix de Chavaux,"- améliorer la circulation piétonne dans le secteur de la
croix de Chavaux (nord Chanzy et Sud Rue de Paris) :
interdire par des plots le stationnement des véhicules
sur les trottoirs; réserver des places de stationnement
pour les camions du marché en hauteur",Valoriser le secteur du marché et sécuriser le quartier le jour des marchés
Aménagement des trottoirs et pose de bancs,Jacqueline Perlin  ,"Ramenas / Léo Lagrange /
Branly-Boissière",,Nouvelle proposition,200000,Aménagement et Mobilier Urbain,,Aménagement des trottoirs et pose de bancs,NON RENSEIGNE,Aménagement des trottoirs et pose de bancs,Aménagement des trottoirs et pose de bancs
Aménagement des trottoirs des rues et des bancs supplémentaires,Jean Raymonde,"Ramenas / Léo Lagrange /
Branly-Boissière",,Nouvelle proposition,200000,Aménagement et Mobilier Urbain,,Aménagement des trottoirs des rues et des bancs supplémentaires ,NON RENSEIGNE,,
"a voir
",Jean-Claude PALLARD,"Bel air-Grands pêchers /
Mur à pêches-Paul Signac",,Nouvelle proposition,,"Mobilité, circulation",,"Réaliser un cheminement pietonnier entre l'espace 40 et l'espace 18 du centre social du Grand Air en passant par le stade J.Delbert et Grands Pêchers, afin de raccourcir le temps de trajet et ceci dans un cadre plus agréable que la rue Lenain de Tillemont.","Entre l'espace 40 et l'espace 18 du centre social du
grand air","Réaliser un cheminement piéton entre l'espace 40
et l'espace 18 du centre social du grand air
en passant par le stade J.Delbert et grands pêchers",Réunir l'espace 40 et l'espace 18 du centre social du Grand air
Fleurissement des espaces verts allée Gustave Courbert,Jean-Pierre Thomassin ,"Ruffins-Théophile Sueur
Montreau-Le Morillon",,Nouvelle proposition,1200,Espaces verts,,implantation de fleurs et d'arbustes sur les pelouses existantes le long des immeubles sur 40 cm de largeur ,Allée Gustave Courbert,Implantation de fleurs et d'arbustes sur les pelouses existantes le long des immeubles sur 40 cm de largeur,Un souci de proposer un environnement fleuri et sécuriser sur l'espace de l'OPHM avec l'apaisement des locataires et la défense des oiseaux avec le CORIF
"
Squares de proximité
",Jeanne Studer,Solidarité-Carnot / Centre Ville / Jean Moulin – Beaumonts,,Nouvelle proposition,,Espaces verts,,"Il s'agit d'utiliser des espaces libres de la ville, petits ou grands, pour en faire des squares de proximité, où les mamans viennent avec leurs enfants pour prendre l'air, et où les enfants peuvent courir et jouer en toute liberté, sans danger.",,"Il s'agit d'utiliser des espaces libres de la ville, petits ou grands, pour en faire des squares de proximité.

Dans ces squares, il y aurait des bancs, des lieux pour les tout-petits avec des bacs à sable, quelques jeux pour les enfants entre 2 ans","CONVIVIALITE et ECHANGE dans un espace dédié à la verdure, au calme et au repos. RESSOURCEMENT apporté par les arbres et la nature"
"
Passage école Henri Wallon
",Jérôme OLIVIER ,"Bel air-Grands pêchers /
Mur à pêches-Paul Signac",,Nouvelle proposition,,Aménagement et Mobilier Urbain,,Il s'agit d'aménager le passage qui relie l'école maternelle Henri Wallon et la rue Paul Doumer en longeant l'école élémentaire.,"entre l'école maternelle H Wallon et l'école
Élémentaire H Wallon (rue Paul Doumer)",Il s'agit d'aménager le passage qui relie l'école maternelle Henri Wallon et la rue Paul Doumer en longeant l'école élémentaire. Ce passage étroit au revêtement inégal et surtout possédant 3 marches à une des extrémités est très emprunté par les parents e," Faciliter la circulation des enfants et parents particulièrement ceux avec poussettes, aux vélos, trottinettes ou ceux à mobilité réduite entre l'école maternelle H Wallon et l'école élémentaire H Wallon (rue Paul Doumer) "
"""Bien vivre dans mon quartier"" d'une façon
Humanitaire",Jocelyne Poullain,"Ruffins-Théophile Sueur
Montreau-Le Morillon",,Nouvelle proposition,,Espaces verts,,"Abris de jardin : outillage, matériel de jardinage + accessoires. Ruches : avec  apiculteurs confirmés, matériaux combinaisons + casques de protectioh + anesthésiant. Maison des insectes au parc Montreau à refaire !!! abandonnée (voir nécessité pour la vie des abeilles)","Dèrrière l'allée Lancelot, près du parc Montreau","Création de :

- Jardins partages (avec association CGL et aux 3F)
- Ferme pédagogique ( avec partenariat de l'école
d'horticulture et jardin école en parallèle)
- Club d'apiculture en parallèle avec la maison des
insectes du parc Montreau

- Abris de jardin",1) jardins partagés (avec association CGL et aux 3F/ 2) ferme pédagogique ( avec partenariat de l'école d'horticulture et jardin école en parallèle)/3) Club d'apiculture en parallèle avec la maison des insectes du parc Montreau
Modifier le stationnement vers le 91 avenue Pasteur,Joel Wrobel ,La Noue-Clos Français / Villiers-Barbuse,,Nouvelle proposition,300,"Mobilité, circulation",,"Actuellement, vers le 91 avenue Pasteur, le stationnement se rétrécit pour disparaître, or les véhicules s'y garent quand même, empiétant sur la voie de gauche de la circulation, ce qui est dangereux.",91 avenue Pasteur,Modifier le stationnement vers le 91 avenue Pasteur,L'idée serait de remplir le triangle du 93 au 91 avenue Pasteur pour éviter que les véhicules s'y garent et gênent la circulation.
Quelques Plots pour des trottoirs libérés,Jose Afonso,"Bas Montreuil-République /
Étienne Marcel-Chanzy / Bobillot",,Nouvelle proposition,,Gestion des déchets,,Poser des bornes anti-stationnement sur une place de parking tous les 50 mètres afin de réserver cet espace aux aux poubelles pour le ramassage.,"dans des rues etroites telle que la rue Paul Bert,
ou certains troncons de la rue Etienne Marcel","Afin de désengorger les trottoirs, surtout dans des rues étroites telle que la rue Paul Bert, ou certains troncons de la rue Etienne Marcel :

Poser des bornes anti-stationnement sur une place de parking tous les 50 mètres afin de réserver cet espace aux aux poubelles pour le ramassage.",Besoin d'espace sur les trottoirs- Amélioration de la circulation des piétons
création participative de mobilier urbain en mosaique,Julia Litvine,"Bel air-Grands pêchers /
Mur à pêches-Paul Signac",,Nouvelle proposition,23000,Aménagement et Mobilier Urbain,,"La Maison de la Plage se chargera de la realisation de la table,de la chaise et de la jardiniere qui serviront de support aux créations en mosaïque.Les artistes intervenants assureront également le suivi technique et les conseils plastiques,ce sont eux qui procéderont à la direction artistique afin d'assurer la cohérence esthétique des oeuvres.",,"L'association La Maison de la Plage propose de créer un espace de convivialité,de rencontres intergénérationnelles au coeur de leur cité. Il existe déjà quatre bancs en briques à double sens de 5 m de long qui serviront de base à cet espace d'échange.
","contribuer à créer du lien social dans un quartier,ameliorer le cadre de vie"
"
Jean Moulin, projet street art dans les HLM
",Julie Vila,Solidarité-Carnot / Centre Ville / Jean Moulin – Beaumonts,,Nouvelle proposition,6000,Education et Jeunesse,,"Il s'agira d'aborder l'art de rue en classe à l'aide de différents supports, de sorties et d'interventions extérieures, le projet final étant que les élèves produisent des graffitis en langue étrangère (espagnol et anglais) sur le mur d'un bâtiment de l'OPHM. ","cité de l'Espoir, mur allée du 14 juillet face au
Terrain multisport",Je suis professeur d'espagnol au collège Jean Moulin de Montreuil. Je souhaiterais monter avec ma collègue d'anglais un projet autour de l'art de rue en collaboration avec un ou des artistes graffeurs montreuillois.,"Sensibiliser les jeunes à l'art urbain autour d'un projet commun, favoriser leur appropriation des cités et embellir leur lieu de vie ainsi que celui du reste des habitants."
Equipement,KACET Kahaled,"Ramenas / Léo Lagrange /
Branly-Boissière",,Nouvelle proposition,180000,Aménagement et Mobilier Urbain,,Equipement,terre plein central de la rue de la Dhuys,"aménagement du terre plein central de la rue de la Dhuys afin d'améliorer la convivialité inter générationnelle

Installer sur le terre plein divers équipements dont : appareils de culture physique (musculation) balançoires, table de ping-pong en dur, tob",
La piste cyclable des Ramenas,KACET Kahaled,"Ramenas / Léo Lagrange /
Branly-Boissière",,Nouvelle proposition,,"Mobilité, circulation",,La piste cyclable des Ramenas,"rue de la Dhuys et/ou rue Saint Denis
Et / ou rue Fernand Lemaze","Réaliser une piste cyclable rue de la Dhuys et/ou rue Saint Denis et / ou rue Fernand Lemaze
",
"Work out République
",Kamez Moussous,"Bas Montreuil-République /
Étienne Marcel-Chanzy / Bobillot",,Nouvelle proposition,,Sports,,Installation d'équipement de musculation extérieure et de divers appareils de fitness ,La dalle du toit de décathlon,"Installation d'équipements de musculation
Extérieure et de divers appareils de fitness
",- Santé et bien être du corps/- Rassemblement des habitants autour d'activités communes/ Loisirs gratuits en libre accès pour la jeunesse
Déclic et des cliques,Karima Adid Guemoune,La Noue-Clos Français / Villiers-Barbuse,,Nouvelle proposition,5500,Economie sociale et solidaire ,,"Accéder et apprendre a utiliser la messagerie électronique : envoyer et recevoir des messages, joindre un fichier, une image ou un texte, Créer sa boite aux lettres, se familiariser avec le traitement de texte et la mise en page de courriers, de curriculum vitaë, de lettres de motivation etc... afin de donner accès a l'autonomie en terme de recherche d'emploi spontanée.",Toute la ville,Répondre aux besoins des habitants en matière d'outil informatique,répondre aux besoins des habitants en matière d'outil informatique
Avenir à venir,Karima Adid Guemoune ,La Noue-Clos Français / Villiers-Barbuse,,Nouvelle proposition,1320,Education et Jeunesse,,Avenir à venir,Cité la noue,"Sollicite des locaux vacants pour offrir aux jeunes adolescntes un lieu de rencontre où elles se sentirons encadrées, orientées assistées et écoutées au quotidien",
bacs à plante et murs végétalisés,Karine Cahen,"Bas Montreuil-République /
Étienne Marcel-Chanzy / Bobillot",,Nouvelle proposition,,Aménagement et Mobilier Urbain,,"L'idée serait de mettre en place à certains coins de rue propices aux dépôts sauvages et sur certains trottoirs un peu larges, devant de grands murs, des bacs à plantes de tailles adaptées, plantes grimpantes sur les murs lorsque cela est possible, pour éviter les tags et rendre la vue plus belle.","Angle des rues Delorme/ Gambetta,
Angle des rues Sergent Godeffroy/ Bonouvrier, Angle des rues Gambetta/ Hayeps,
Devant le 6 rue Colonel Delorme.","Mettre en place des bacs à plantes grimpantes
devant les grands murs (à certains coins de rue
propices aux dépôts sauvages et sur
certains trottoirs un peu larges) pour éviter les
tags et rendre la vue plus belle.", Rendre la ville plus belle et éviter les tags et les dépôts sauvages
Donner de la couleur au Square Demi Cercle,Kathy Voisembert ,Solidarité-Carnot / Centre Ville / Jean Moulin – Beaumonts,,Nouvelle proposition,,Espaces verts,,Donner de la couleur au Square Demi Cercle,square demi cercle,"Ré-aménagement du square par :

- réhaussement des clotures (cause d'intrusion et dégats la nuit )
- terrain multisport – pose des jeux (enveloppe EPQ)
- fontaine - banc- réhabilité le chalet ACR (détruit après 10 ans de vandalisme )
- appropriation d'un ", Recréer du lien social dans le square demi cercle peu utilisé pour causes de mauvaises fréquentations.
"Femmes du monde en action
",LATTIER Denise,La Noue-Clos Français / Villiers-Barbuse,,Nouvelle proposition,,Culture et loisirs,,"Femmes du monde en action
",,voir pièce jointe,
Montreuil à vélo,LE BRIS DUREST Emmanuel,"Ramenas / Léo Lagrange /
Branly-Boissière",,Nouvelle proposition,,Aménagement et Mobilier Urbain,,Montreuil à vélo,NON RENSEIGNE,"revoir/améliorer les pistes cyclables existantes, en créer de nouvelles sur des parcours réfléchis, concertés avec d'autres usagers du vélo et avec la Ville, sur un parcours, un quartier, un secteur ou la ville. Penser au plan plus général, plus homogène,",
"Sauvons nos Vélib'
",Léa Lamerre,Solidarité-Carnot / Centre Ville / Jean Moulin – Beaumonts,,Nouvelle proposition,,Aménagement et Mobilier Urbain,,"Face à la recrudescence des vols et des dégradations des vélos en libre-service, il est indispensable de sécuriser les bornes Vélib'. Positionner des potelets de sécurité entre chaque bornes pour entraver l'action des voleurs.",,"Sécuriser les bornes Vélib'.

Positionner des potelets de sécurité entre chaque bornes pour entraver l'action des voleurs.

L'accessibilité aux transports est une priorité pour la ville et les habitants.","Favoriser les transports dans la ville. Actuellement les Vélib' sont sans cesse volés, de fait les bornes sont bloquées. Cela pénalise les habitants. "
