name,author,district_name,address,collect_status,estimation,category,summary,body,Adresse,Résumé,Objectif
"1, 2, 3, 4. Enfin, un chantier-école de maintenance des murs à pêches et un espace publique patrimonial dans les murs à pêches !",Pascal Mage ,"Bel air-Grands pêchers /
Mur à pêches-Paul Signac",,Nouvelle proposition,,Culture et loisirs,,"Besoin d'activités culturelles dans l'espace public et d'accès libre : utiliser l'espace public pour accueillir des événement culturels comme des installations de Land'Art à rayonnement international. Enfin, un chantier-école de maintenance des murs à pêches et un espace publique patrimonial dans les murs à pêches !",,pascal Mage (pascal.mage@wanadoo.fr)," Besoin d'un point d'ancrage patrimonial pour les habitants dans notre ville en pleine mutation urbaine. . Il s'agit donner la possibilité aux montreuillois et aux habitants du quartier et aux scolaires, de découvrir le patrimoine des murs à pêches d'une façon récréative"
Emplacement parking pour motos et arceaux pour vélos en dehors des lieux commerciaux ou lieux municipaux.,Pascale Peuziat,"Bel air-Grands pêchers /
Mur à pêches-Paul Signac",,Nouvelle proposition,1000,Aménagement et Mobilier Urbain,,"Pour les motos : empiéter sur un espace de parking à voiture, pour faire 2 places de motos ou scooter dans une rue. Pour les vélos : prévoir au moins 2 arceaux pour garer des vélos dans une rue. Et l'envisager plus globalement dans chaque rue du quartier","au début de la rue rochebrune et dans d'autres rues
du quartier","Pour les motos :

empiéter sur un espace de parking à voiture, pour faire 2 places de motos ou scooter dans une rue.

dans ma rue, rue rochebrune, il y a 1 à 2 motos qui se garent sur le trottoir. Mais envisager ce projet dans les autres rues. ",Eviter que des motos se garent sur le trottoir. Idem pour les vélos. Donner la possibilité aux personnes qui n'ont pas de garage ou de local à vélo de garer leur vélo. Ainsi que des places pour les visiteurs. Encourager aussi les déplacements en vélo ou moto.
Modification du mur d'enceinte du square Marcel Cachin,Pascale Peuziat,"Bel air-Grands pêchers /
Mur à pêches-Paul Signac",,Nouvelle proposition,20000,Aménagement et Mobilier Urbain,,"Il s'agirait de conserver les sous bassements du mur d'enceinte à partir du portail jusqu'au virage de l'avenue Paul signac. Des fissures très importantes se creusent de plus en plus. Il s'agirait de détruire les 3/4 des murs, garder le soubassement et les piliers et rajouter une grille entre les piliers. Ces grilles doivent être assez hautes pour qu'on ne puissent pas les franchir.","Près du du square de l'avenue A.Briand et de
la place du 8 mai 1945. Consolider le mur qui
Se fend très gravement.","Il s'agirait de conserver les sous bassements du mur d'enceinte à partir du portail jusqu'au virage de l'avenue Paul signac. Des fissures très importantes se creusent de plus en plus. Il s'agirait de détruire les 3/4 des murs, garder le soubassement",Donner une meilleure visibilité du square de l'avenue A.Briand et de la place du 8 mai 1945. Consolider le mur qui se fend très gravement.
Panneaux d'affichage pour le conseil de quartier,Pascale Peuziat,"Bel air-Grands pêchers /
Mur à pêches-Paul Signac",,Nouvelle proposition,10000,Aménagement et Mobilier Urbain,,"Il s'agirait d'implanter des panneaux d'affichage fermant (la clé serait donné aux collectif) pour que les membres du collectif d'animation posent les affiches des réunions plénières. Actuellement cet affichage se fait à la sauvage, sur les poteaux, sur les murs, ce qui est interdit me semble t'il ?","dans le quartier, un par rue
",Implanter des panneaux d'affichage fermant (la clé serait donné aux collectif) pour que les membres du collectif d'animation posent les affiches des réunions plénières.,Pouvoir rendre visible les annonces des réunion plénières du Conseil de quartier
"
terrain de proximité Edouard Vaillant
",Patrice Martin ,"Bas Montreuil-République /
Étienne Marcel-Chanzy / Bobillot",,Nouvelle proposition,100000,Sports,,Notre projet correspond à une forte attente des jeunes du quartier qui se sentent défavorisés par l'absence d'espace de terrain de sport dans le quartier. Ils sont très mobilisés autour de ce projet avec une présence régulière aux réunions de conseil de quartier avec notamment 16 d'entre eux présents lors du vote de ce projet au dernier conseil.,,"Refaire entièrement le terrain multi sport avec :

- refaire entièrement le revêtement de sol de l'ensemble du terrain de foot et de basket en revêtement synthétique type SBR

- création d'un espace de street work out (en remplacement du petit terrain de ",Offrir aux jeunes du quartier un espace de jeu de qualité
Poser un coussin ralentisseur,PEUZIAT Pascale,"Bel air-Grands pêchers /
Mur à pêches-Paul Signac",,Nouvelle proposition,200000,"Mobilité, circulation",,Poser un coussin ralentisseur,Rue de la rochebrune,"Mettre un coussin ralentisseur juste avant la rue de l'ermitage afin de faire ralentir les voitures qui montent.

Mettre aussi un panneau à la fin de la rue de l'ermitage pour indiquer que les voitures n'ont pas la priorité. Il n'est pas possible de mettr",
Innover pour donner un avenir aux Murs à Pêches,Philippe Shuler ,"Bel air-Grands pêchers /
Mur à pêches-Paul Signac",,Nouvelle proposition,50000,Espaces verts,,Le projet vise à expérimenter des techniques nouvelles pour apporter des solutions simples et peu coûteuses aux 3 besoins suivants : - arrêter l'érosion des murs existants – élaborer une méthodologie de restauration des murs – élaborer de murs à pêches préfabriquer en ateliers,,Inventer de nouvelles techniques de montage de murs qui respectent la fonction horticole et permettent de reconstituer le paysage des murs à pêches. Ces techniques contemporaines doivent être accessibles à toute entreprise générale mais aussi aux particuliers," Le patrimoine des murs à pêches est  un marqueur de la ville de Montreuil. Mais petit à petit les murs disparaissent, faute de solutions pour entretenir et faire vivre ce patrimoine horticole au XXI ème siècle "
"Goudronnage et fermeture
portail du sentier des messiers",Raphaël DOUGE,"Bas Montreuil-République /
Étienne Marcel-Chanzy / Bobillot",,Nouvelle proposition,,"Mobilité, circulation",,"goudronnage complet du sentier des messiers pour le sortir de cet état de décrépitude. Éviter le dépôt d'ordures sauvage et la saleté générale-fermeture par un système de tourniquet pour stopper le ""rodéo scooter"" très dangereux pour les enfants qui passent énormément dans ce sentier-donner un environnement plus chaleureux pou le futur jardin éducatif du sentier des messiers",Sentier des Messiers,"Goudronnage complet du sentier et fermer
l'accès aux scooters par un système de
Tourniquet","Propreté du sentier, sécurité des passants"
Halte aux allergènes – retrait des plantes allergisantes,Rose Donzenac,"Ramenas / Léo Lagrange /
Branly-Boissière",,Nouvelle proposition,,Espaces verts,,Nettoyage du pied des tilleuls en mettant des copeaux et éviter que cela devienne la décharge de toutes les rues - plus l'élagage des tilleuls qui créé des allergies (santé publique). Les ralentisseurs actuels sont des nuisances sonores,Toutes les rues,"Nettoyage du pied des tilleuls en mettant des copeaux et éviter que cela devienne la décharge de toutes les rues - plus l'élagage des tilleuls qui créé des allergies (santé publique)

Les ralentisseurs actuels sont des nuisances sonores","De la propreté du quartier - de la santé, des nuisances sonores "
Rénovation et aménagement du CLEC de La Noue,ROSSI Christina / DE LUNA Ines,La Noue-Clos Français / Villiers-Barbuse,,Nouvelle proposition,,Culture et loisirs,,Rénovation et aménagement du CLEC de La Noue,CLEC,"Réfection des sols et des peintures sur l'ensemble du CLEC. Dans la grande salle du fond : parquet flottant, miroirs sur 3 faces (Nord, Ouest et Est), appliques lumineuses au mur (lumière danse). Sur la face Sud aménagement d'une aération efficace. Matéri",
Vert Montreuil,SABBAN ,"Bas Montreuil-République /
Étienne Marcel-Chanzy / Bobillot",,Nouvelle proposition,250000,Aménagement et Mobilier Urbain,,"Les ZAC en cours sont un formidable tremplin pour inscrire la ville dans une nouvelle dynamique, mais ces projets d'envergures sont malheureusement d'une extrême lenteur et ne porteront sans doute leur fruits que dans une décénnie.
Sans revenir sur le patrimoine industriel de la ville en déclin conjoncturel, Montreuil n'a sans doute pas réussi parfaitement sa mue au cours de ces trente dernières années, laissant derrière elle une certaine ""sinistrose visuelle"" dans les rues montreuilloises. L'élan porté sur le cœur de ville, et sa nouvelle esplanade, doit aujourd'hui servir à toute la commune.VERT MONTREUIL !
Est un pied de nez à la sinistrose visuelle montreuilloise.
L'aménagement Navoiseau (opération PEPA) en est le parfait exemple ! Une rue métamorphosée en espace semi-piéton avec des fleurs, des herbes, des arbres... le résultat : des enfants qui jouent à la marelle dans la rue. La magie opère, un esprit rural dans une commune urbaine.Le concept VERT MONTREUIL est de reproduire ce schéma idyllique sur les boulevards, les avenues, les rues,les impasses et tout l'espace public. Redonner du VERT à une commune grisonnante dont les espaces verts publics sont si peu nombreux.
Comment y parvenir ?
Des solutions très simples existent. Supprimer des espaces alloués aux stationnement automobile pour y planter des essences d'arbres décoratifs, persistants, écologique et facile d'entretien.",Allées menant au marché de la Croix de Chavaux,"Remplacement de places de
stationnement par des arbres",Embellir la ville Se réapproprier de l'espace public Repenser la circulation automobile Réduire la pollution Démarche écologique
"
Mur d'escalade
",SFM Montreuil,"Ramenas / Léo Lagrange /
Branly-Boissière",,Nouvelle proposition,,Culture et loisirs,,"Poser un petit mur d'escalade sur le champ de poires pour les enfants de 4 à 6 ans sur le champ de poires, avenue Salvador Allende."," sur le champ de poires, avenue Salvador Allende.","Poser un petit mur d'escalade pour les enfants de 4 à 6 ans sur le champ de poires, avenue Salvador Allende.", Développement des enfants de 4 à 6 ans
Place de la république en zone piétonne,Shadownic,"Bas Montreuil-République /
Étienne Marcel-Chanzy / Bobillot",,Nouvelle proposition,,Aménagement et Mobilier Urbain,,"La place de la République est sous exploitée et tres mal aménagé, centre névralgique et vitrine du bas de montreuil, on est tres loin de la place de village...le jardin est lugubre, les bars/restos délaissées et ce meme le weekend...",La place de la République,"Place très mal aménagée.
Rendre les abords de la place 100% piéton
et réaménager le jardin",Améliorer la qualité de vie
Sous la houlette du calligraphe,Stephanie Daniel-Risse,Solidarité-Carnot / Centre Ville / Jean Moulin – Beaumonts,,Nouvelle proposition,15000,Solidarité,,"C'est un lieu de rencontres que nous proposons de faire apparaître en y installant un triporteur (petite camionnette).Le Triporteur offre aux passants un temps d'échanges autour d'une boisson faite avec les herbes de la nature alentour : le parc des Beaumonts, le jardin partagé du Ring,",Parc des Beamonts,Vivre ensemble et mise en valeur de la bio diversité, vivre ensemble et mise en valeur de la bio diversité
Pôle de l'écrit et de l'image,"Stéphanie De Lara Association ""FINAL CUT 93"" (nom du collectif) ",La Noue-Clos Français / Villiers-Barbuse,,Nouvelle proposition,,Culture et loisirs,,"Un projet commun et fédérateur. Ce lieu ferait de rencontrer les populations de Villiers-Barbusse et de La Noue Clos français, pour contribuer à la mixité sociale autour d'ateliers, pluridisciplinaires et interculturels, basés sur des thèmes fédérateurs.",Entre les quartiers de la Noue et de Villiers-Barbusse.,"
Volonté de créer un équipement de
loisirs/culture/détente ?

Pas de localisation précise

Par qui sera gérer ce lieu ?
(agent de la ville/ porteur du projet?)
","Développer un espace dédié aux arts de l'écrit et de l'image. favoriser la mixité et l'échange culturel, de toutes origines (mali, Sénégal, Maghreb, Pakistan, Europe)."
"marcher sur les trottoirs, empêcher les voitures de s'y garer, et les motos d'y circuler",TEMPIA Diana,"Ruffins-Théophile Sueur
Montreau-Le Morillon",,Nouvelle proposition,,"Mobilité, circulation",,"marcher sur les trottoirs, empêcher les voitures de s'y garer, et les motos d'y circuler",,Protéger les trottoirs par des barrières pour que les voitures ne s'y garent pas et obligent les piétons à marcher sur le trottoir.,
Aménager un espace pour les containers poubelle,Theo Thyr ,"Bas Montreuil-République /
Étienne Marcel-Chanzy / Bobillot",,Nouvelle proposition,,Gestion des déchets,,Cette demande concerne la chaussée devant le 85 rue Marceau.,85 rue Marceau,Libérer le trottoir des contenairs poubelles,Libérer le trottoir des containers poubelle
"
café littèraire
",Toumbou Bocar ,La Noue-Clos Français / Villiers-Barbuse,,Nouvelle proposition,60000,Culture et loisirs,,"ce café littéraire est un carrefour des cultures,un lieu qui propose de rendre le livre familier et le plaisir de la culture accessible à tous.",,"Céfé littéraire, lieu d'échanges de savoirs et de débat, pouvant accueillir jusqu'à 30 personnes dans le but favoriser l'accès de tous à la lecture et à la création littéraire.

nous proposons un club Ado,un atelier parents lecteurs,un club de lecture ain",Mettre dans les quartiers dit populaire l'amour de la lecture
Les petits pots dans les grands,Virginie Warion,"Ruffins-Théophile Sueur
Montreau-Le Morillon",,Nouvelle proposition,33000,Aménagement et Mobilier Urbain,,"Dans l'idée que le beau appelle le beau, et dans la continuité d'une expérience déjà mené ( fabrication et mise en place d'un très gros bac à fleurs à un endroit  habituellement occupé par des tas de déchets sauvages),  nous souhaiterions mettre en place de très gros pots de couleur ou bacs plantés sur le trottoir entre les numéros  42 et 60 de la rue Nungesser, au droit de la clôture du cap Nungesser et ainsi créer une coupure végétal entre habitat et activité.",42 et 60 de la rue Nungesser,"Fédérer, occuper, améliorer la cohabitation ent re habitantet activité, impliquer les habitants dans l'évolution du quartier Nungesser Coli. Apporter une continuité au projet du jardin partagé Le petit Jardin, mise en place par les habitants en invitant l",impliquer les habitants dans l'évolution du quartier
Salaris,YAHYA ADJI,"Bas Montreuil-République /
Étienne Marcel-Chanzy / Bobillot",,Nouvelle proposition,,Aménagement et Mobilier Urbain,,Les cabines téléphoniques ne sont plus utilisées et sont démontées. Il en reste 2 place de la République sans panneaux solaires et de branchements pour recharger tout types de téléphone ou de tablette sans que la consommation électrique retombe sur la collectivité ,,"Faciliter l'accès à la téléphonie mobile pour les
personnes les plus défavorisées et aussi pour les
personnes en panne de batterie de téléphone

Certaines personnes très défavorisées n'ont pas de
lieux ou les recharger. Certains se branchent sur
les prise"," Faciliter l'accès à la téléphonie mobile,  pour les personnes les plus défavorisées et aussi pour les personnes en panne de batterie de téléphone "
La terrasse Robert Legros,Yildirim Harun,"Bel air-Grands pêchers /
Mur à pêches-Paul Signac",,Nouvelle proposition,,Aménagement et Mobilier Urbain,,Installation de bancs et différents mobiliers urbain en face de la maison de quartier du Grand Air – Espace 18 ,17 rue des petits pêchers,"Création d'un lieu de rencontre : Installer des bancs
et du mobilier urbain en face de la maison de quartier
du grand air – Espace 18",à déterminer les objectifs
(R) évolution des espaces verts,Yohan sancerni,La Noue-Clos Français / Villiers-Barbuse,,Nouvelle proposition,,Espaces verts,,Le quartier de La noue-clos français dispose de beaucoup d'espaces verts non utilisés et pas mis en valeur. Ces espaces verts sont malheureusement en majorité juste des crottoires pour chiens.Avec cela des accès plus aménagés avec des bancs et passages tracés dans les espaces laissés à l'abandon.,Quartier de La Noue – Clos Français,Rendre les espaces verts plus vivants et participatifs,rendre les espaces verts plus vivants et participatifs
"
Un skatepark appelé « Les Merrics »
",ZENNOU Zachary,"Bel air-Grands pêchers /
Mur à pêches-Paul Signac",,Nouvelle proposition,140000,Sports,,"
Un skatepark appelé « Les Merrics »
","la place des hautes hules près du terrain de
football synthétique rue Lenain de Tillemont","Skatepark à la place des hautes hules près du terrain de football synthétique rue Lenain de Tillemont
",
Double-sens cyclable rue François Arago,Anonyme,"Bas Montreuil-République /
Étienne Marcel-Chanzy / Bobillot",,Nouvelle proposition,500,"Mobilité, circulation",,Double-sens cyclable rue François Arago,"Portion de rue François Arago entre la rue
Diderot et la rue Gambetta","Cette portion est en sens unique.Matérialiser
un double-sens cyclable, par des panneaux
à chaque extrémité et un marquage au sol",
"La mobilité, l'accessibilité pour les personnes handicapées et âgées",Anonyme,La Noue-Clos Français / Villiers-Barbuse,,Nouvelle proposition,,"Mobilité, circulation",,"Rendre accessible pour les personnes handicapées (tous handicapes) et pour les personnes âgées, tous les lieux de la ville. Par exemple : Améliorer la signalitique pour les personnes mal voyantes, retirer les poteaux noir (ou insérer des couloirs visible), élargir et bien éclairer les trottoirs, intégrer des signaux sonores pour indiquer que l'on peut traverser, etc. ",TOUTE LA VILLE,"Rendre accessible aux personnes handicapées (tout handicap) et aux personnes âgées : commerce, restaurant, mobilité dans la ville « largeur des trottoirs) et signalétique



Les aménagements (élargissement et revêtement) de trottoir sur le tronçon de la r","Rendre accessible aux personnes handicapé (tout handicape) et aux personnes âgées : commerce, restaurant, mobilité dans la ville (largeur des trottoirs), signalétiques  "
Mon vélo sans soucis,Anonyme,Solidarité-Carnot / Centre Ville / Jean Moulin – Beaumonts,,Nouvelle proposition,,"Mobilité, circulation",,"Innover en investissant dans du mobilier urbain spécifique et visiblement incitatif à la pratique du vélo,Enfin le passage en zone 30 de l'intégralité du territoire devrait nous permettre d'envisager un futur plus serein et plus efficace à tout point de vue pour nos déplacements dans notre ville.",La ville,"Pour une ville plus humaine et plus apaisée, faciliter les déplacements à vélo en investissant dans un écosystème urbain adapté aux déplacements à vélo","Pour une ville plus humaine et plus apaisée, faciliter les déplacements à vélo en investissant dans un écosystème urbain adapté aux déplacements à vélo."
Paul Signac et peintures : un parcours découverte,Anonyme,"Bel air-Grands pêchers /
Mur à pêches-Paul Signac",,Nouvelle proposition,,Culture et loisirs,,La proposition fusionnée  qui pourrait intituler « Parcours et aventure Signac »  intègre donc : L'aménagement du local et la signalétique permettant de rendre visible et pérenniser les informations urbaines glanées lors du travail d'enquête mené  par la Cie Fictions collectives dans le cadre du projet de l'aventure Signac. ,Quartier Paul Signac,Embellir le quartier, Embellir le quartier Paul Signac - Faire découvrir les œuvres du peintre qui porte ce nom
"Piétonnisation des rues de la place du marché
Et de la place du marché",Anonyme,"Bas Montreuil-République /
Étienne Marcel-Chanzy / Bobillot",,Nouvelle proposition,,Aménagement et Mobilier Urbain,,"L'idée est de transformer la place du marché en véritable place piétonne. La fermeture des rues se feraient avec des poteaux amovibles pour que les camions de marché puissent s'installer et permettre la livraison des commerces.De plus, l'absence de chaussée permet d'avoir une surface pour les événements plus grandes.",la place du marché et rue de la place du marché,"Transformer la place du marché en véritable place piétonne.
La fermeture des rues adjacentes ainsi que leur mise à
niveau par rapport au trottoir permettra aux commerces
riverains de proposer des terrasses (beaucoup de
restaurants et bar).

La fermetures ",Amélioration de la qualité de vie et de la sécurité
"Près des yeux, près du cœur",Anonyme,Solidarité-Carnot / Centre Ville / Jean Moulin – Beaumonts,,Nouvelle proposition,,Culture et loisirs,,"Le projet est une installation urbaine reliant le haut et le bas Montreuil, elle serait accessible à tous le monde selon les horaires d'ouverture au public des sites choisis. Ce projet s'ancre également dans l'histoire économique de la ville. ","sur la terrasse de Mozinor et celle du site retenu du
Bas Montreuil","Installer sur la terrasse de Mozinor et celle du site retenu du Bas Montreuil, deux longues-vues fixes, puissantes, dirigées l'une vers l'autre","Relier le haut et le bas Montreuil, voir la ville autrement, découvrir  et s'amuser en même temps "
Réaménagement espace ex-PARCABOUT,Anonyme,"Ruffins-Théophile Sueur
Montreau-Le Morillon",,Nouvelle proposition,250000,Urbanisme,,"Agrandir l'espace clos en déplaçant le grillage qui sépare de la Grande Halle pour récupérer la pelouse (jusque la partie goudronnée) Les enfants pourraient jouer au ballon, les parents restant à l'ombre, se ferait aussi un lieu idéal de pique-nique avec un BBQ collectif (à imaginer?)",Rue Barbeuf situé angle rue Babeuf et Blvd Théophile Sueur,Réaménagement espace ex-PARCABOUT," vie de quartier animation jeunesse, Espace clos permettant l'accueil de familles avec jeunes enfants, groupes d'écoles, centres de loisir."
