name,author,district_name,address,collect_status,estimation,category,summary,body,Adresse,Résumé,Objectif
"Aménagement piétons, mobilité circulation",Anne SOUNNAC,"Ramenas / Léo Lagrange /
Branly-Boissière",,Nouvelle proposition,,"Mobilité, circulation",,"Refaire les trottoirs rue Fernand Combette, débaptiser le non de cette rue",Quartiers Signac et Ramenas,Refaire les trottoirs rue Fernand Combette et débaptiser le nom de cette rue,"Amélioration urbaine, mobilité"
Ouvrir le square rue Pépin aux familles et aux enfants,Rebecca.jourdain,Solidarité-Carnot / Centre Ville / Jean Moulin – Beaumonts,,Nouvelle proposition,30000,Aménagement et Mobilier Urbain,,"Il s'agit de l'aménager en y installant des bancs, ainsi qu'une aire de jeux pour les enfants.Ce square ne doit pas être un simple lieu de passage - voire, le soir, un lieu qu'on évite.Il est suffisamment grand pour accueillir les enfants du quartier qui souhaitent jouer en plein air, dans un espace vert, et pour permettre aux habitants des rues environnantes de bénéficier d'un lieu favorisant le lien social.",Rue Pépin,Aménagement du square Pépin,L'objectif de ce projet est de permettre aux Montreuillois du quartier de s'approprier le square rue Pépin (derrière l'église St Pierre-St-Paul) et de l'investir pleinement.
"Des coussins berlinois pour les
Montreuillois",Adeline DUCRET,"Ramenas / Léo Lagrange /
Branly-Boissière",,Nouvelle proposition,,"Mobilité, circulation",,"Au niveau du croisement avec le boulevard Aristide Briand, le carrefour des deux rues apparaît aujourd'hui dangereux.","Entre le 100 et 110 de la rue Saint-Denis
et entre le 137 et 150 Boulevard Aristide
Briand","Des coussins berlinois dans les deux
sens de circulation et une signalétique
pour prévenir les véhicules pour améliorer
la sécurité et réduire les nuisances sonores",Ce projet répond à un double objectif: améliorer la sécurité routière et réduire les nuisances sonores.
Gloire aux nouveaux trottoirs!,Adeline DUCRET,"Ramenas / Léo Lagrange /
Branly-Boissière",,Nouvelle proposition,,"Mobilité, circulation",,"Des travaux de réfection semblent absolument nécessaires aux usagers de ce secteur, composé d' équipements publics ( école, collège, bibliothèque) et de nombreuses habitations. Afin de faciliter l'accessibilité des piétons, notamment avec des poussettes, les trottoirs doivent être remis à niveau, goudronnés et agrémentés d'arbres et sécurisés avec de nouveaux plots anti stationnement. ","- La rue des Saules Clouets (jusqu'au croisement
de la rue Demi Lune).
- La rue Saint Denis ( du boulevard A.Briand au
carrefour Colonel Fabien).
- La rue Danielle Casanova.
- Le passage des écoles .","les trottoirs doivent être remis à niveau,
goudronnés et agrémentés d'arbres et
sécurisés avec de nouveaux plots
Anti stationnement.",Faciliter l'accessibilité des piétons
Un effort pour le terrain de sport!,Adeline DUCRET,"Ramenas / Léo Lagrange /
Branly-Boissière",,Nouvelle proposition,,Sports,,"Le terrain de basket et de football situé à coté du gymnase Boissière, boulevard Aristide Briand est d'une rare vétusté. Le revêtement a absolument besoin d'être refait à neuf, avec un marquage au sol plus résistant.Enfin, les bordures actuellement délaissées, pourront être agrémentées de plantes et de fleurs grimpantes, le long de la nouvelle clôture.","Le terrain de sport situé à coté du gymnase Boissière, boulevard Aristide Briand.","- Refaire le revêtement à neuf + nouveau marquage
au sol plus resistant.
- Remplacement des paniers paniers de basket et
des buts.
- Des bancs en bois
- Nouvelle clôture (structure en bois)
- Agrémenter les bordures délaissées de plantes
et de fleurs grim",Pour donner l'envie de s'y rendre
Jardin et aliment à partager,Alan Homont,La Noue-Clos Français / Villiers-Barbuse,,Nouvelle proposition,,Espaces verts,,"Mise en place de bacs de jardinage potager bio qui permettraient à tous les habitants du quartier, de planter, cultiver et de manger des aliments sains. Une appropriation citoyenne de l'écologie,de travail en dehors du salariat, de l'espace public par les habitants (tour), de tisser le lien social. Cela part de conjuguer avec le futur bac à composter et peut-être les futurs ...",Quartier La Noue,"Mise en place de bacs de jardinage potager bio qui permettraient à tous de planter, cultiver et de manger sains","A l'alimentation, au partage, au jardinage, à la pédagogie (écoles, collèges, crèches, centres de loisirs et associations) à la coopération intergénérationnel"
Espace vert mobilité des piétons,Anne-Marie FOSLIN,"Ramenas / Léo Lagrange /
Branly-Boissière",,Nouvelle proposition,250000,Aménagement et Mobilier Urbain,,"Les trottoirs sont difficilement empruntables, cela entraîne des incidences sur la sécurité des piétons.",Rue des Saules Clouet et avenue du Colonel Fabien,"Abattage des arbres dont les racines soulèvent le
Goudron des trottoirs et les remplacer par d'autres
Catégories d'arbres dont les racines s'enfoncent dans
Le sol","Eviter la déformation des rues et des trottoirs, dues aux énormes racines d'accacias "
Sécurisation des passages piétons,Annie Metayer ,Solidarité-Carnot / Centre Ville / Jean Moulin – Beaumonts,,Nouvelle proposition,,"Mobilité, circulation",,Sécurisation des passages piétons,TOUTE LA VILLE,"Installer des ralentisseurs devant chaque
Passage piéton sans feux",
résolution des soucis de stationnement pour les grands pêchers,Armand  Tabernat,"Bel air-Grands pêchers /
Mur à pêches-Paul Signac",,Nouvelle proposition,,"Mobilité, circulation",,"Alors le projet est de réaménager la rue Lenain de Tillemont tout le long du jardin école pour que l'on puisse se garer, tout en conservant la piste cyclable.",,"stationnement anarchique: dans la rue Henri Wallon, du Super U aux pieds de la cité, la chaussé sert de parking. Un peu plus loin, du jardin école à l'école maternelle Henri Wallon, le stationnement se fait sur le trottoire, empechant son usage aux piéton",manque de stationnement dans le quartier des grands pêchers.
"""69 rue Pierre de Montreuil""",Association Lez'Arts dans les Murs,"Bel air-Grands pêchers /
Mur à pêches-Paul Signac",,Nouvelle proposition,150000,Aménagement et Mobilier Urbain,,"L'association Lez'Arts dans les Murs qui gère un jardin partagé dans le site classé des Murs à Pêches, rue Pierre de Montreuil, a récemment signé une convention avec la Ville de Montreuil qui lui permet de disposer d'un accès sur la rue .Cet accès se situe au numéro 69 de la rue Pierre de Montreuil à la frontière entre le quartier des Murs à Pêches et celui du Bel Air, en face de la toute nouvelle rue de Cottbus. Afin d'en faire un vrai équipement de proximité pour les habitants du quartier et les Montreuillois en général voire plus largement tous les visiteurs des Murs à Pêches !",69 Rue Pierre de Montreuil,"Aménagement de cet espace pour y installer un
espace d'information/de réunions/d'ateliers sur les
associations et le site des Murs à Pêches,un point
sanitaire (toilettes sèches), des jeux pour enfants,
des arbres (pêchers), des bancs, des tables","Amélioration des conditions d'accueil dans le jardin partagé de l'association dans le site classé des Murs à pêches pour les enfants des centres de loisirs et des écoles de la Ville, mais aussi les habitants du quartier et les visiteurs en général"
Réaménagement en rue piétonne,BENYOUNES Cédric,"Ramenas / Léo Lagrange /
Branly-Boissière",,Nouvelle proposition,30000,Aménagement et Mobilier Urbain,,Réaménagement en rue piétonne,'une portion de la rue de la Renardière.,"Aménagement en rue piétonne ouverte à la circulation d'une portion de la rue de la Renardière.

Marquage au sol en voie douce (cycles, piétons, …) extensible de la future station « Boissière Dhuys » à la future station du tramway « Césaria Evora » via la ",
Assurer aux jeunes du quartier l'accès à un lieu de rencontre et de pratique sportive,Bernard Lelièvre,"Bel air-Grands pêchers /
Mur à pêches-Paul Signac",,Nouvelle proposition,,Sports,,"L'accès à cet espace est un élément d'équilibre pour ce quartier, les jeunes - adolescents, jeunes adultes, parfois accompagnés de plus jeunes - s'y retrouvent en grand nombre.",17 boulevard Arisitide Briand,Assurer aux jeunes l'accès à un lieu de rencontre,Il est primordial d'assurer la continuité de cette offre qui contribue à l'équilibre et la bonne entente du quartier
Extermination d'une déchetterie sauvage pour un parterre fleuri,Caroline Dessimond ,Solidarité-Carnot / Centre Ville / Jean Moulin – Beaumonts,,Nouvelle proposition,5000,Espaces verts,,"Répartition des poubelles (qu'elles ne soient pas toutes au même endroit - Réaménagement de l'îlot de l'angle de la rue Charles Infroit et rue Molière -Réaménagement du trottoir contre la maison du 26 rue Charles Infroit - Sur l'îlot faire pousser des fleurs ce qui évitera aux gens des dépots sauvage - Sur le trottoir, un blanc pour accéder aux passages piétons ",Rue Charles Infroit et de la rue Molière,"Répartition des poubelles pour qu'elles ne soient pas toutes au même endroit, réaménagement de l'ilôt de l'angle de la rue Charles Infroit et rue Molière, réaménagement du trottoir contre la maision du 26 rue Charles Infroit, sur l'ilôt, y faire pousser d",Le projet répond à une amélioration de l'îlot et du bout de la rue Charles Infroit et de la rue Molière
Renouveau des moineaux,Catherine Vella ,Solidarité-Carnot / Centre Ville / Jean Moulin – Beaumonts,,Nouvelle proposition,,Espaces verts,,Redonner un nouvel aspect au square des Moineaux (ajaout d'un ou 2) – revitalisation des espaces verts ,square des Moineaux,"Redonner un nouvel aspect au square des Moineaux
en revitalisant/créant des espaces verts",Rénovation du square des moineaux
Création d'un poulailler,Catherine Vigneron ,"Ruffins-Théophile Sueur
Montreau-Le Morillon",,Nouvelle proposition,,Espaces verts,,Nous désirons créer une association qui prendrait en charge la mise en place d'un poulailler de 6 à 10 poules.,16 A rue Paul Lafarge,"Nous désirons créer une association qui prendrait en
charge la mise en place d'un poulailler de 6 à 10 poules.
Une fois le démarrage assuré, nous voulons offrir à tous,
la possibilité de venir aider à nourrir les poules, à ramasser
les oeufs ou observer l", Création de lieu social dans le quartier
CUM Collective Urban Modules,Cédric Benyounès ,"Ramenas / Léo Lagrange /
Branly-Boissière",,Nouvelle proposition,10000,Aménagement et Mobilier Urbain,,"Conception et réalisation de modules d'aménagement urbains sous forme circulaires déclinant différent usages collectifs à associer et étendre sur tous les quartiers :
",Tous les quartiers,"Mixité, lutte contre le désœuvrement des jeunes, amélioration cadre de vie, usages participatifs"," Mixité, lutte contre le désœuvrement des jeunes, amélioration cadre de vie, usages participatifs ."
Renardière semi-piétonne végétalisée,Cédric Benyounès ,"Ramenas / Léo Lagrange /
Branly-Boissière",,Nouvelle proposition,30000,Aménagement et Mobilier Urbain,,"Aménagement au carrefour du chemin des Redoutes pour empêcher le dépôt sauvage d'ordures, la prise de la rue en sens interdit et le stationnement gênant pour les piétons.",Abords de la station Boissière – Dhuys,"Sécurisation, aménagement et propreté de la rue de la Renardière aux abords de la station Boissière-Dhuys","Sécurisation, aménagement et propreté de la rue de la Renardière aux abords de la station Boissière."
Square intergénérationel Léo,Céline / Marie-Brigitte HEDHUIN / LEVASSOR,"Ramenas / Léo Lagrange /
Branly-Boissière",,Nouvelle proposition,,Espaces verts,,Square intergénérationel Léo,,"Réhabilitation des espaces verts et publics
dans le quartier Ramenas-Léo Lagrange,
qui n'ont pas eu de rénovation depuis plus
de 2 ans pour répondre à un besoin de vivre
Ensemble

note descriptive en PJ",
Améliorer la qualité de l'air,CHAMBET Nicolas,"Bel air-Grands pêchers /
Mur à pêches-Paul Signac",,Nouvelle proposition,,Aménagement et Mobilier Urbain,,Améliorer la qualité de l'air,"rue de Romainville, rue Pépin","Planter des arbres le long des rues.
Si les trottoirs sont trop étroits, alors les élargir.",
Favoriser la circulation piétonne ou à vélo,CHAMBET Nicolas,"Bel air-Grands pêchers /
Mur à pêches-Paul Signac",,Nouvelle proposition,,Aménagement et Mobilier Urbain,,Favoriser la circulation piétonne ou à vélo,NON RENSEIGNE,"Interdire ou réduire la circulation dans certaines rues.

Poser des ralentisseurs et réduire la voie de circulation au bénéfice des trottoirs dans la rue de Romainville et la rue pépin.",
Barbac RUF1,Cherif Cheniti ,"Ruffins-Théophile Sueur
Montreau-Le Morillon",,Nouvelle proposition,30000,Aménagement et Mobilier Urbain,,"Aménager une très grande partie du jardin pédagogique pour permettre aux habitants de faire des barbceue. Avec un système de réservation , gérer par un jeune ou moins jeune du quartier en chômage de longue durée (un emploi d'avenir par exemple )",Quartier,Permettre aux habitants du quartier de pouvoir faier des barbecues en toute tranquillité,Permettre aux habitants du quartier de pouvoir faire des barbecue en toute tranquillité
Novelle aire de jeux à la Noue,Claire Milani,La Noue-Clos Français / Villiers-Barbuse,,Nouvelle proposition,130000,Aménagement et Mobilier Urbain,,"Depuis plusieurs années nous disposons d'un terrain de sable qui n'est pas exploité à sa juste valeur au vu de son état.Nous avons donc donné la parole aux enfants du centre de loisirs Joliot Curie élémentaire, pour qu'ils nous fassent des propositions pour un aménagement de cet espace. ce terrain de sable se trouve entre le gymnase Joliot Curie et l'école Joliot Curie.
",La Noue,"Favoriser le vivre ensemble, offrit un espace de loisirs","Favoriser le vivre ensemble, offrir un espace de loisirs pour le quartier"
Rucher des Chlorophiliens,Claudie Hersent ,"Bel air-Grands pêchers /
Mur à pêches-Paul Signac",,Nouvelle proposition,5000,Espaces verts,,"Un rucher dans un jardin de quartier, un geste écologique, bio et responsable mais aussi vecteur de cohésion sociale. Installation de ruches et développement d'activités de sensibilisation et d'initiation à l'apiculture en milieu urbain ",Rucher des Chlorophiliens,Sensibilisation à la protection de l'environnement,Sensibilisation à la protection de l'environnement
OXYMORE : Des lieux associatifs ouverts l'été à la place des friches de nos quartiers,Clément Girard ,"Bel air-Grands pêchers /
Mur à pêches-Paul Signac",,Nouvelle proposition,20000,Aménagement et Mobilier Urbain,,Oxy More est une régie associative créée pour ouvrir des lieux éphémères l'été. Nous souhaitons proposer la gestion de ces lieux à des associations locales. Le but étant qu'elles puissent bénéficier d'une activité économique et d'une visibilité temporaires pour mieux conduire leurs autres causes ou projets par la suite. ,Quartier Paul Signac,Occuper temporairement des terrains en friche de nos quartiers,Occuper temporairement des terrains en friche pour créer des lieux associatifs éphémères conviviaux dans les quartiers.
Panneaux / paniers de basket,Corinne OLABISI,"Bel air-Grands pêchers /
Mur à pêches-Paul Signac",,Nouvelle proposition,700,Sports,,"Réparer ou remplacer les panneaux de basket sur le terrain de plein air, situé devant le gymnase Henri Wallon, et acollé à l'école primaire Henri Wallon. Depuis que les terrains de baskets ont été cassés les jeunes ont très peu d'endroit pour pratiquer du sport.",Rue Henri Wallon,"Réparer ou remplacer les panneaux de
basket sur le terrain de plein air. Trouver
des astuces pour faire respecter le
Matériel (affiches humoristiques, …)",Faire du sport
Esprits Footés,Delphine misaine,La Noue-Clos Français / Villiers-Barbuse,,Nouvelle proposition,6500,Culture et loisirs,,"A la demande des jeunes du quartiers et afin de donner la parole a des passionnés de footbal pour analyser et débattre de l'actualité foot et de tous les sujets du ballon rond, de l'Euro 2016 et de la Coupe du Monde 2018.",,"Installer un environnement dédiés aux échanges conviviaux, pertinents et intelligents, pendant et après les matchs.

il convient donc d'avoir un grand écran de TV, une table, des chaises, un tableau blanc, les abonnements aux chaines sportives ainsi qu'un",Canaliser les énergies positives des jeunes par le partage d'une passion
construire une porte d'entrée du site des murs à pêches,Diana Tempia ,"Bel air-Grands pêchers /
Mur à pêches-Paul Signac",,Nouvelle proposition,,Aménagement et Mobilier Urbain,,"Le site des murs à pêches n'est pas visible par ceux qui ne le connaissent pas: proposition de construire une porte d'entrée du site sur le modèle de la porte d'entrée du jardin école tout proche, ","A l'entrée du site des murs à pêches : à la fin de
la rue St Antoine, juste après le 33 rue Pierre-Jean
De Béranger,","Construire une porte d'entrée du site sur le modèle de la porte d'entrée du jardin école tout proche, avec une variante, l'enduire du même plâtre que celui utilisé sur les murs à pêches, et bien sûr, l'écriture ""entrée du site des murs à pêches"".

La port",Pallier au manque de visibilité du quartier des murs à pêches
une jardinière réalisée et entretenue par les habitants du quartier,Diana Tempia ,"Ruffins-Théophile Sueur
Montreau-Le Morillon",,Nouvelle proposition,,Aménagement et Mobilier Urbain,,"construire, entre habitants, une jardinière sur la chaussée pour la rétrécir et ainsi empêcher les voitures de se garer sur le trottoir, car ces véhicules sont parfois incendiés. Les plantes seront installées et entrenues par les habitants.",,"construire, entre habitants, une jardinière sur la chaussée pour la rétrécir et ainsi empêcher les voitures de se garer sur le trottoir. Les plantes seront installées et entrenues par les habitants.",Rétrécir la chaussée pour empêcher les incendies de voitures
L'école du pain,Didier Bodelot,La Noue-Clos Français / Villiers-Barbuse,,Nouvelle proposition,10000,Education et jeunesse,,L'école du pain,,"Aménager l'espace autour du four:
- extension de la dalle de béton devant et sur le côté droit du four 
- installation de volets mobiles en bois en position fermée: protection intégrale du four
en position ouverte: prolongement du auvent devant le four (+","Eveiller et éduquer par la fabrication du pain ""hors les murs"" de l'école. faciliter l'accueil du public Protéger le four et les publics accueillis Soulager la gestion des salles de la maison de quartier."
Des livres pour tous,Dominique Delage,"Ramenas / Léo Lagrange /
Branly-Boissière",,Nouvelle proposition,1100,Culture et loisirs,,"Faisons des livres un élément du paysage urbain, un objet que chacun peut s'approprier et favorisons autour d'eux l'échange entre les habitants.",,"Installer des ""boîtes"" contenant des livres, dans les espaces publiques permet aux adultes, aux enfants d'emprunter un ou des livres puis de le(s) redéposer.",mettre des livres à la disposition de tous et gratuitement
Place nette,Drogoz Carpentier Elisabeth,Solidarité-Carnot / Centre Ville / Jean Moulin – Beaumonts,,Nouvelle proposition,,Espaces verts,,"Le petit passage qui relie la rue Rabelais (à hauteur du 24/26) à l'avenue de la Résistance est un véritable coupe george. Un lieu toujours sale et une pissotière aussi. Une géométrie bizarre qui jouxte cet espace est un fouillis de végétation dense et laide où s'entasse toutes sortes d'ordures et de drogues. Enlever cet espace supprimeraient tous ces désagréments. C'est aussi un lieu de rencontres de drogues, je les vois de ma fenêtre.","la rue Rabelais et de l'avenue de la Résistance face aux
logements HLM","Espace de végétation dense où s'entassent toutes sortes
d'ordures et de drogues.

Enlever cet espace supprimerait tous ces désagréments.

","Un besoin esthétique  lié à une meilleure visibilité, éviter l'accumulation de déchets et les rencontres de drogues"
"Sécurité piétons
",Drogoz Carpentier Elisabeth,"Bas Montreuil-République /
Étienne Marcel-Chanzy / Bobillot",,Nouvelle proposition,,"Mobilité, circulation",,"Devant le « Monoprix » de la Croix de Chavaux, circulent vélos, motos, patinettes et rollers. Les piétons ne sont pas en sécurité. Les véhicules arrivent à toute vitesse depuis la rue Parmentier pour venir se garer soi devant le monoprix soit devant la pharmacie de la Croix de Chavaux.","Devant le « Monoprix » de la Croix de Chavaux :
espace entre rue Parmentier et avenue de la
Résistance","Les véhicules arrivent à toute vitesse depuis la
rue Parmentier pour venir se garer soi devant le
monoprix soit devant la pharmacie de la croix de
Chavaux.

Il faut envisager un stationnement de ces véhicules
en dehors des trottoirs.
","Circuler sur le trottoir sans avoir peur des motos, vélos, patinettes et rollers qui déboulent à toute vitesse"
"
Lieu de rencontre pour les assistantes maternelles
",EL AYYADI Céline,La Noue-Clos Français / Villiers-Barbuse,,Nouvelle proposition,,Education et jeunesse,,"
Lieu de rencontre pour les assistantes maternelles
",,"Les assistantes maternelles implantées sur les quartiers Villiers/La Noue et clos francais sont confrontées à la saturation des capacités d'accueil du relais d'assistantes maternelles de la ville ainsi que de son éloignement géographique
",
"
Montreuil Basket!
",Elias Waldman,"Bas Montreuil-République /
Étienne Marcel-Chanzy / Bobillot",,Nouvelle proposition,,Sports,,"Le projet serait de refaire un revêtement durable et adapté au basket qui nous permette de jouer dans de bonnes conditions. Le fait d'avoir deux panneaux nous permettrait aussi de faire des matchs ou de jouer à plusieurs sur chaque panneau. Il s'agit de réhabiliter le terrain de basket de la rue Edouard Vaillant qui est aujourd'hui en terre battue et sable. Sur ce terrain, un seul des panneaux est fonctionnel.",terrain de basket de la rue Edouard Vaillant,"Réhabiliter le terrain de basket de la rue Edouard Vaillant qui est aujourd'hui en terre battue et sable. Sur ce terrain, un seul des panneaux est fonctionnel.

Le projet serait de refaire un revêtement durable et adapté au basket qui nous permette de jou","Réunir des personnes du quartier (enfants, adolescents, adultes) pour jouer au basket"
Kid's Corner,Emmanuel Guinot,"Bas Montreuil-République /
Étienne Marcel-Chanzy / Bobillot",,Nouvelle proposition,,Espaces verts,,"créer un espace vert aménagé, avec des jeux pour les enfants, en lieu et place du terrain vague / ""terrain sportif"" dit ""Square des Expulsés"" situé entre le 42 et le 50 rue Edouard Vaillant",Quartier Bas Monrteuil / Bobillot,Pallier au déficit de squares et d'espaces verts dans le quartier,Pallier au déficit de squares et d'espaces verts dans le quartier du bas montreuil
Quartier pacifié,Emmanuel Guinot,"Bas Montreuil-République /
Étienne Marcel-Chanzy / Bobillot",,Nouvelle proposition,,"Mobilité, circulation",,"La sécurité des piétons est réellement menacée, dans la mesure où ces bolides surgissent à tout moment dans des toutes petites rues, très résidentielles ; ces rues sont particulièrement fréquentées par les jeunes enfants, qui ne sont plus en sécurité","Rues Douy Delcupe, Beaumarchais et Sergent Godefroy",Sécuriser un quartier confronté à des excès de vitesse particulièrement inquiétants,Sécuriser un quartier confronté à des excès de vitesse particulièrement inquiétants
Tout l'univers de Jules Verne en place,Eric Loubet ,"Ramenas / Léo Lagrange /
Branly-Boissière",,Nouvelle proposition,,Aménagement et Mobilier Urbain,," S'appuyer sur ce qui est déjà en place : les animations et réunions enfantines ; l'installation paysagère (cultures et animations) ; la situation géographique (dénivellement) ; l'ouverture du champ visuel et la visibilité-L'aspect paysager peut se voir comme des petits jardins de babylone (idées de cultures en terrasse, en espalier, etc.), jouant avec le relief du terrain pour créer des mini-cultures (pourquoi pas un filet d'eau ?). Un accent particulier doit être mis pour protéger et mettre en valeur le platane, ainsi que les tilleuls (qui se meurent).",Place Jules Verne,Modification de la place,pour créer des mini-cultures à travers des animations et réunions enfantines
Créer un média de proximité « la pêche hors les murs » (webradio),Estelle Feliculis,"Bel air-Grands pêchers /
Mur à pêches-Paul Signac",,Nouvelle proposition,153750,Culture et loisirs,,"Création de La pêche hors les murs, média de quartier en lien avec un grand média national notre projet est de créer une Webradio de proximité qui s'articule avec une expérience / un quartier / une ville et le reste du monde.",Quartier La Pêche,Créer un média de proximité « la pêche hors les murs » (webradio),Renforcer les liens_Vivre ensemble_S'exprimer_Citoyenneté
