type,contributions_id,contributions_author_id,contributions_section_title,contributions_title,contributions_bodyText,contributions_createdAt,contributions_updatedAt,contributions_url,contributions_published,contributions_trashed,contributions_trashedStatus,contributions_trashedAt,contributions_trashedReason,contributions_votesCount,contributions_votesCountOk,contributions_votesCountMitige,contributions_votesCountNok,contributions_argumentsCount,contributions_argumentsCountFor,contributions_argumentsCountAgainst,contributions_sourcesCount,contributions_versionsCount,contributions_arguments_related_id,contributions_arguments_related_kind,contributions_arguments_id,contributions_arguments_author_id,contributions_arguments_type,contributions_arguments_body,contributions_arguments_createdAt,contributions_arguments_updatedAt,contributions_arguments_url,contributions_arguments_published,contributions_arguments_trashed,contributions_arguments_trashedStatus,contributions_arguments_trashedAt,contributions_arguments_trashedReason,contributions_arguments_votesCount,contributions_votes_id,contributions_votes_author_id,contributions_votes_value,contributions_votes_createdAt,contributions_reportings_related_id,contributions_reportings_related_kind,contributions_reportings_id,contributions_reportings_author_id,contributions_reportings_type,contributions_reportings_body,contributions_reportings_createdAt,contributions_sources_id,contributions_sources_related_id,contributions_sources_related_kind,contributions_sources_author_id,contributions_sources_trashed,contributions_sources_trashedStatus,contributions_sources_trashedAt,contributions_sources_trashedReason,contributions_sources_body,contributions_sources_createdAt,contributions_sources_updatedAt,contributions_sources_published,contributions_sources_votesCount,contribution_versions_id,contribution_versions_title,contribution_versions_bodyText,contribution_versions_createdAt,contribution_versions_updatedAt
opinion,opinion82,VXNlcjphZG1pbkNhcGNv,"La section","Opinion in private project","Bonjour je suis une opinion dans une étape de consultation d'un projet privé, et toi à quoi tu joue ?","2018-03-01 14:00:00",,https://capco.dev/consultations/qui-doit-conquerir-le-monde-visible-par-les-admins-seulement/consultation/consultation-step-in-private-project-admin-only/opinions/la-section-le-sous-titre/opinion-in-private-project,Yes,No,,,,1,1,0,0,0,0,0,0,0,,,opinion82,VXNlcjphZG1pbkNhcGNv,,,"2018-03-01 14:00:00",,https://capco.dev/consultations/qui-doit-conquerir-le-monde-visible-par-les-admins-seulement/consultation/consultation-step-in-private-project-admin-only/opinions/la-section-le-sous-titre/opinion-in-private-project,Yes,No,,,,1,opinion82,VXNlcjphZG1pbkNhcGNv,,"2018-03-01 14:00:00",,,opinion82,VXNlcjphZG1pbkNhcGNv,,,"2018-03-01 14:00:00",opinion82,,,VXNlcjphZG1pbkNhcGNv,No,,,,,"2018-03-01 14:00:00",,Yes,1,opinion82,"Opinion in private project","Bonjour je suis une opinion dans une étape de consultation d'un projet privé, et toi à quoi tu joue ?","2018-03-01 14:00:00",
vote,,,,,,,,,,,,,,,,,,,,,,,,,,,,,,,,,,,,,,T3BpbmlvblZvdGU6ODI=,,YES,"2015-03-01 00:00:00",,,,,,,,,,,,,,,,,,,,,,,,,
opinion,opinion83,VXNlcjp1c2VyMg==,"La section","Opinion 2 in private project","Bonjour je suis une autre opinion dans une étape de consultation d'un projet privé, et toi à quoi tu joues ?","2018-03-01 14:00:00",,https://capco.dev/consultations/qui-doit-conquerir-le-monde-visible-par-les-admins-seulement/consultation/consultation-step-in-private-project-admin-only/opinions/la-section-le-sous-titre/opinion-2-in-private-project,Yes,No,,,,0,0,0,0,1,0,1,1,1,,,opinion83,VXNlcjp1c2VyMg==,,,"2018-03-01 14:00:00",,https://capco.dev/consultations/qui-doit-conquerir-le-monde-visible-par-les-admins-seulement/consultation/consultation-step-in-private-project-admin-only/opinions/la-section-le-sous-titre/opinion-2-in-private-project,Yes,No,,,,0,opinion83,VXNlcjp1c2VyMg==,,"2018-03-01 14:00:00",,,opinion83,VXNlcjp1c2VyMg==,,,"2018-03-01 14:00:00",opinion83,,,VXNlcjp1c2VyMg==,No,,,,,"2018-03-01 14:00:00",,Yes,0,opinion83,"Opinion 2 in private project","Bonjour je suis une autre opinion dans une étape de consultation d'un projet privé, et toi à quoi tu joues ?","2018-03-01 14:00:00",
source,,,,,,,,,,,,,,,,,,,,,,,,,,,,,,,,,,,,,,,,,,,,,,,,,source45,opinion83,opinion,VXNlcjp1c2VyQWRtaW4=,No,,,,"Et la j'écris juste des trucs qui me passent pas la tête parce que j'aime pas le lorem ipsum ça enlève le lore.","2016-03-01 00:00:00","2016-03-01 00:00:00",Yes,1,,,,,
argument,,,,,,,,,,,,,,,,,,,,,,,opinion83,opinion,argument254,VXNlcjphZG1pbkNhcGNv,AGAINST,"Je suis un argument sur une opinion dans une consultation d'une étape de consultation provenant d'un projet privé (admin).","2019-06-01 00:52:00","2019-06-01 00:52:00",https://capco.dev/consultations/qui-doit-conquerir-le-monde-visible-par-les-admins-seulement/consultation/consultation-step-in-private-project-admin-only/opinions/la-section-le-sous-titre/opinion-2-in-private-project#arg-argument254,Yes,No,,,,1,,,,,,,,,,,,,,,,,,,,,,,,,,,,,
version,,,,,,,,,,,,,,,,,,,,,,,,,,,,,,,,,,,,,,,,,,,,,,,,,,,,,,,,,,,,,,version17,"Je suis une opinion version d'une opinion d'une consultation dans un projet privé.","Magni voluptates harum modi tempore quis numquam. Est atque nulla rerum et aut aut fugit.","2015-01-03 00:00:00",
vote,,,,,,,,,,,,,,,,,,,,,,,,,,,,,,,,,,,,,,VmVyc2lvblZvdGU6NzAwMDUy,,YES,"2015-01-01 00:00:00",,,,,,,,,,,,,,,,,,,,,,,,,
